"created_time","account","post_type","icon","tag_id","tag_name","impressions","impressionsVmedian","impressionsVmean","engagements","engagementsVmedian","engagementsVmean","engagementRate","engrtVmedian","engrtVmean","postClicks","shares","brand","program","accountType","post","perma_link","text","tag1","tag2","tag3","tag4","tag5","tag6","tag7","tag8","tag9","tag10","tag11","campaignID"
2025-10-13,"RMI Brand","Facebook",2,3135076,"[1] 17. Energy Transition Narrative [transition-narrative]",507,0.081,-0.166,20,0.333,-0.262,0.039,0.114,0.054,4,1,1,0,"RMI Brand","Post","https://www.facebook.com/344520634375161/posts/1281443917349490","Across the United States, the transition to affordable, clean energy is taking shape in ways we can all see and feel. Solar panels line the rooftops of schools and libraries. EV charging stations stand ready in grocery store parking lots. Electric buses and service vehicles are rolling out to replace diesel fleets. 

Behind every project is a story, and every story has to start somewhere: a conversation, a calculation, a leap of faith. These projects come to life through the persistence and creativity of individuals and teams determined to build a cleaner future. 

RMI's new ‘Voices of Clean Energy’ shares these stories. Each profile highlights the people turning ideas into action: grant writers, project managers, engineers, community leaders, and more. Each story captures the technical expertise, community ties, and determination that helps our nation’s energy systems progress. 

By elevating these voices, we honor the individuals building a healthier energy landscape — and invite others to join in. 

Hear their stories: https://bit.ly/4n6Shhg","[3] Text Graphic","[2] RMI Policy","[1] 17. Energy Transition Narrative [transition-narrative]","[4] RMI Landing Page","[1] 16. Facilitate Effective Deployment Of IRA Funding​",NA,NA,NA,NA,NA,NA,"transition-narrative"
2025-10-13,"RMI Brand","Twitter",3,3135076,"[1] 17. Energy Transition Narrative [transition-narrative]",514,-0.047,-0.202,48,0.655,0.283,0.093,0.979,0.476,19,7,1,0,"RMI Brand","Post","https://twitter.com/RockyMtnInst/status/1977770844668436699","Across the U.S., clean energy is taking shape: solar on schools, EV chargers at stores, electric buses on our streets. 

RMI’s new ‘Voices of Clean Energy’ highlights the people making it possible — one project at a time. 

Learn more: https://t.co/li00eF4hai https://t.co/wpF0EDJAKO","[3] RMIer(s)","[3] Real People","[2] RMI Brand","[3] Text Graphic","[2] RMI Policy","[4] RMI Landing Page","[1] 17. Energy Transition Narrative [transition-narrative]","[1] 16. Facilitate Effective Deployment Of IRA Funding​",NA,NA,NA,"transition-narrative"
2025-10-06,"RMI Brand","Instagram",4,3998255,"OCI+",1179,0.332,0.217,17,-0.105,-0.202,0.014,-0.3,-0.364,NA,1,1,0,"RMI Brand","Post","https://www.instagram.com/p/DPfE8gzDE15/","Each step of the oil and gas production process — from extraction, processing, and transport — needs energy. This means that emissions intensity – the level of emissions per barrel of oil or gas — can vary wildly depending on those processes. We also can’t forget super-heating methane, which can leak at any one (or all) of these steps. 

This difference in intensity can have profound impacts on energy security and public safety, but has largely been hidden from markets, regulators, and citizens for decades. 

RMI’s free interactive Oil Climate Index plus Gas (OCI+) tool reveals life-cycle emissions, highlights areas to prevent energy waste, and shares strategies so that industry, policymakers, investors, and researchers can take action to tackle methane leaks. The latest update of OCI+ also includes satellite observation data from @carbonmapper’s Tanager-1 and other point source satellites to combine detected methane measurements with modeled estimates. 

OCI+ underscores the critical role of targeted, resource-specific strategies to reduce energy waste, cut oil and gas emissions, and make the benefits of reducing emissions more transparent for decision-makers. 

Click the link in our bio to learn more about how we can take methane waste from invisible to securable. 

#MethaneMonday","[3] Not Graphic Template","[1] 12. Reduce Methane Leakage In India, China, US​","[3] Text Graphic","[5] Bloomberg Methane","[3] Figure/ Graph","[2] RMI Intelligence",NA,NA,NA,NA,NA,"oci+"
2025-10-06,"RMI Brand","Twitter",3,3135066,"OCI+",441,-0.183,-0.315,45,0.552,0.203,0.102,1.17,0.619,10,9,1,0,"RMI Brand","Post","https://twitter.com/RockyMtnInst/status/1975230915056984319","RMI’s Oil Climate Index plus Gas (OCI+) tool reveals life-cycle emissions, highlights areas to prevent energy waste, and shares strategies so that industry, policymakers, investors, and researchers can take action to tackle methane leaks. https://t.co/y7u7YAsWJC https://t.co/8etgmDtGok","[1] 12. Reduce Methane Leakage In India, China, US​","[3] Not Graphic Template","[3] Text Graphic","[5] Bloomberg Methane","[3] Figure/ Graph","[2] RMI Intelligence",NA,NA,NA,NA,NA,"oci+"
2025-10-03,"RMI Brand","Twitter",3,3926918,"nycw25",485,-0.101,-0.247,49,0.69,0.31,0.101,1.149,0.603,17,3,1,0,"RMI Brand","Post","https://twitter.com/RockyMtnInst/status/1974220523333628250","This year's #ClimateWeekNYC drew a record 100k+ attendees, including many RMIers. This year, the focus shifted to private sector priorities such energy, data centers, and competitiveness. 

Here are deeper reflections from RMIers on the ground👇 
https://t.co/XMnY1nwvNv https://t.co/iqD5uVYMtR","nycw25","[4] Internal Article/ Blog","[3] Text Graphic","[4] Post Event/ Webinar","[2] RMI Brand",NA,NA,NA,NA,NA,NA,"nycw25"
2025-10-03,"RMI Brand","Instagram",4,3926918,"nycw25",1266,0.431,0.307,23,0.211,0.08,0.018,-0.1,-0.182,NA,5,1,0,"RMI Brand","Post","https://www.instagram.com/p/DPXB3EwkrNF/","This year’s Climate Week NYC drew record participation with nearly 1,000 events and 100,000+ attendees, despite a rollback in US clean energy support. This year, there was less discussion on policy-led decarbonization and a greater focus on the energy transition by the private sector. 

At the top of the corporate docket: effectively meeting rising costs for power, dealing with the rise in power demand from data centers, and how to lift US competitiveness in clean industry. 

RMIers led conversations on removing market barriers, such as establishing better carbon accounting standards, as well as technical steps to lower emissions from shipping, aviation, and other industries. 

💡 Visit the link in our bio to read what they took away from the whirlwind week!","nycw25","[4] Internal Article/ Blog","[3] Text Graphic","[4] Post Event/ Webinar","[2] RMI Brand",NA,NA,NA,NA,NA,NA,"nycw25"
2025-10-03,"RMI Brand","Facebook",2,3926918,"nycw25",489,0.043,-0.196,26,0.733,-0.041,0.053,0.514,0.432,15,2,1,0,"RMI Brand","Post","https://www.facebook.com/344520634375161/posts/1271686114991937","This year’s Climate Week NYC drew record participation with nearly 1,000 events and 100,000+ attendees, despite a rollback in US clean energy support. This year, there was less discussion on policy-led decarbonization and a greater focus on the energy transition by the private sector. 

At the top of the corporate docket: effectively meeting rising costs for power, dealing with the rise in power demand from data centers, and how to lift US competitiveness in clean industry.  

RMIers led conversations on removing market barriers, such as establishing better carbon accounting standards, as well as technical steps to lower emissions from shipping, aviation, and other industries. 

Here’s what they took away from the whirlwind week👇 

https://bit.ly/3KFViaF","nycw25","[4] Internal Article/ Blog","[3] Text Graphic","[4] Post Event/ Webinar","[2] RMI Brand",NA,NA,NA,NA,NA,NA,"nycw25"
2025-09-26,"RMI Brand","Instagram",4,3926918,"nycw25",1031,0.165,0.064,12,-0.368,-0.437,0.012,-0.4,-0.455,NA,0,1,0,"RMI Brand","Post","https://www.instagram.com/p/DPE_gt5iVHT/","Clean energy can deliver economic growth, make companies more cost-competitive, and cut consumers’ risks of surprise spikes in energy prices. Motivated by these and other benefits of advanced energy systems, communities and states across America, as well as  most countries globally, are speeding the shift. 

US renewable power output has risen sharply since 2000, driven by a combination of falling costs and supportive policies. While related federal incentives have fluctuated, state-level policies have remained steadier. Early embrace of renewables by community leaders, businesses, and elected leaders, combined with states’ economic development efforts, have laid a durable foundation. 

And as homeowners, cities, and countries reckon with rising costs due to damage amplified by climate change — such as homes lost to wildfire, flash floods from unprecedented deluges, and crops lost to drought — cutting emissions remains a top priority, along with improving energy accessibility, reliability, and affordability. 

Click the link in our bio to learn more about the market dynamics, politics, and policy driving the shift to clean energy.","[1] 13. Empower Leaders To Fast-Track Clean Energy Trans","nycw25","[3] Text Graphic","[4] RMI Landing Page","[3] Figure/ Graph","[2] RMI Brand",NA,NA,NA,NA,NA,"nycw25"
2025-09-26,"RMI Brand","Twitter",3,3926918,"nycw25",412,-0.236,-0.36,21,-0.276,-0.439,0.051,0.085,-0.19,14,2,1,0,"RMI Brand","Post","https://twitter.com/RockyMtnInst/status/1971652300176347330","Motivated by economic, competitive, and national security benefits, US states and local communities are transitioning to advanced energy systems.  

RMI analysis highlights the market dynamics, politics, and policy driving the shift to clean energy: https://t.co/To681xNK8R https://t.co/CdxbrX9KHc","[1] 13. Empower Leaders To Fast-Track Clean Energy Trans","nycw25","[3] Text Graphic","[4] RMI Landing Page","[3] Figure/ Graph","[2] RMI Brand",NA,NA,NA,NA,NA,"nycw25"
2025-09-25,"RMI Brand","Twitter",3,3926918,"nycw25",444,-0.177,-0.311,12,-0.586,-0.679,0.027,-0.426,-0.571,8,0,1,0,"RMI Brand","Post","https://twitter.com/RockyMtnInst/status/1971333163130482818","Many worthwhile energy projects around the world are slowed by financial obstacles. 

The US can help de-risk and incentivize investments to unlock private capital, diversify supply chains, and expand markets for US companies. https://t.co/B4sm6jXAAP https://t.co/rDWNd86sOO","[1] 13. Empower Leaders To Fast-Track Clean Energy Trans","nycw25","[4] Internal Article/ Blog","[3] Text Graphic","[2] RMI Policy",NA,NA,NA,NA,NA,NA,"nycw25"
2025-09-25,"RMI Brand","Twitter",3,3926918,"nycw25",394,-0.27,-0.388,11,-0.621,-0.706,0.028,-0.404,-0.556,6,0,1,0,"RMI Brand","Post","https://twitter.com/RockyMtnInst/status/1971279814595051683","RMI CEO @Jon_Creyts: ""Eighty percent of the world is still very much moving on the fast track toward clean energy.""

We’re working with decision makers and industry leaders to transition to a cleaner, more prosperous, and more secure energy future for all: https://t.co/CQoB17PleB https://t.co/Vatvy8qDMa","[1] 13. Empower Leaders To Fast-Track Clean Energy Trans","Jon Creyts","[3] Real People","[2] RMI Brand","nycw25","[3] Text Graphic","[4] RMI Landing Page",NA,NA,NA,NA,"nycw25"
2025-09-24,"RMI Brand","Facebook",2,3926918,"nycw25",429,-0.085,-0.294,13,-0.133,-0.52,0.03,-0.143,-0.189,5,3,1,0,"RMI Brand","Post","https://www.facebook.com/344520634375161/posts/1263701242457091","Nations continue to miss their commitments to cut global warming pollution. But, as countries slow down, big companies are speeding up — they’re cutting emissions, saving energy, and lowering costs. RMI is helping the private sector move faster by strengthening markets for sustainable products through aggregated demand, collective action, advocacy, and clean energy projects.  

RMI partners directly with companies to co-develop strategies and solutions, including how to decarbonize supply chains, design infrastructure, and optimize the clean energy grid. Through these collaborations, we help businesses accelerate innovation and tap into opportunities for clean solutions. 

We serve as implementers, conveners, advisors, and collaborators to help companies deliver and scale market-driven solutions across the energy system. Learn more about how we work with companies to move ambition to action: https://bit.ly/42LwxzX

#UNGA80 #UN80 #UnitedNations","[3] Digital Illustration","nycw25","[1] No outcome","[4] RMI Landing Page","Corporate","[2] RMI Brand",NA,NA,NA,NA,NA,"nycw25"
2025-09-24,"RMI Brand","Twitter",3,3926918,"nycw25",680,0.26,0.056,32,0.103,-0.144,0.047,0,-0.254,25,2,1,0,"RMI Brand","Post","https://twitter.com/RockyMtnInst/status/1970957190992212199","""Companies want to have a share in producing clean energy tech...and profit from the single largest capital formation in history."" — Sarah Ladislaw, RMI @ #ClimateWeekNYC w/ @Reuters + @C3Solutions_

Clean energy is a climate solution and global economic transformation. https://t.co/zz8DCXSYsU","[1] 13. Empower Leaders To Fast-Track Clean Energy Trans","nycw25","[4] Internal Article/ Blog","[3] Text Graphic","[2] RMI Policy",NA,NA,NA,NA,NA,NA,"nycw25"
2025-09-24,"RMI Brand","Twitter",3,3926918,"nycw25",445,-0.175,-0.309,7,-0.759,-0.813,0.016,-0.66,-0.746,4,0,1,0,"RMI Brand","Post","https://twitter.com/RockyMtnInst/status/1970926344553877996","In the race to cut carbon pollution, companies are taking the lead over countries. At RMI, we partner with companies to co-develop strategies and solutions to help deliver and scale market-driven advanced energy solutions. https://t.co/mMClFTzoTM

#UNGA80 #UN80 #UnitedNations https://t.co/M2W3QZV9L4","[3] Digital Illustration","nycw25","[1] No outcome","Corporate","[4] RMI Landing Page","[2] RMI Brand",NA,NA,NA,NA,NA,"nycw25"
2025-09-24,"RMI Brand","Facebook",2,3926918,"nycw25",44,-0.906,-0.928,6,-0.6,-0.779,0.136,2.886,2.676,3,1,1,0,"RMI Brand","Post","https://www.facebook.com/344520634375161/posts/1263111035849445","Together, companies can strengthen markets for sustainable products through aggregated demand, collective action, advocacy, and clean energy projects.  

RMI partners directly with companies to co-develop strategies and solutions, including how to decarbonize supply chains, design infrastructure, and optimize the clean energy grid. Through these collaborations,  we are working to support sustainable businesses in reaching their goals and accelerating innovation opportunities and clean solutions to complex challenges. 

We serve as implementers, conveners, advisors, and collaborators to help companies deliver and scale market-driven solutions across the energy system. Learn more about how we work with companies to move ambition to action: https://bit.ly/42LwxzX","[3] Digital Illustration","nycw25","[1] No outcome","[4] RMI Landing Page","Corporate","[2] RMI Brand",NA,NA,NA,NA,NA,"nycw25"
2025-09-23,"RMI Brand","Facebook",2,3926918,"nycw25",421,-0.102,-0.308,11,-0.267,-0.594,0.026,-0.257,-0.297,3,2,1,0,"RMI Brand","Post","https://www.facebook.com/344520634375161/posts/1262775919216290","Businesses trying to reduce their scope 3 emissions need to buy cleaner fuels and products such as steel, cement, aluminum, plastics, and fertilizers. But production of these clean inputs is only just getting started, meaning supply is limited and buying options are scarce. 

Corporate buyers and procurement teams hold the key to changing that. By showing a willingness to pay for cleaner materials and signing longer-term contracts, companies can give suppliers the confidence and financing they need to scale up production.  

Our new report, launched today at #GreenMarketsDay25 at #ClimateWeekNYC, breaks down the tools companies can use to accelerate this transition and illustrates how voluntary buyer action has helped scale other solutions such as CDR technology and sustainable aviation fuel. 

Here’s what RMI’s Josh Henretig had to say:  

""Acting early isn’t just about cutting emissions, it’s a strategic investment. First movers strengthen their brands, secure scarce supply, and help shape the future markets."" 

For more, read our report, Catalytic Procurement: How Corporations Can Lead the Green Commodity Transition 👉 https://bit.ly/4mrwi49","[1] 14. Drive Market For Climate Products And Services","nycw25","[4] RMI Report","[3] Text Graphic","[2] RMI Intelligence",NA,NA,NA,NA,NA,NA,"nycw25"
2025-09-23,"RMI Brand","Twitter",3,3926918,"nycw25",461,-0.146,-0.284,14,-0.517,-0.626,0.03,-0.362,-0.524,9,2,1,0,"RMI Brand","Post","https://twitter.com/RockyMtnInst/status/1970607443248914463","Cutting Scope 3 emissions means companies need to buy cleaner materials, but supplies are scarce for these nascent technologies. Corporate buyers can pool demand &amp; back long-term contracts, making them key to unlocking new markets.

Our report shows how → https://t.co/HTGOFUDta5 https://t.co/5bi6Wmv4zX","[1] 14. Drive Market For Climate Products And Services","nycw25","[4] RMI Report","[3] Text Graphic","[2] RMI Intelligence",NA,NA,NA,NA,NA,NA,"nycw25"
2025-09-23,"RMI Brand","Instagram",4,3926918,"nycw25",947,0.07,-0.023,11,-0.421,-0.484,0.012,-0.4,-0.455,NA,0,1,0,"RMI Brand","Post","https://www.instagram.com/p/DO9ddekjGZK/","Businesses trying to reduce their scope 3 emissions need to buy cleaner fuels and products such as steel, cement, aluminum, plastics, and fertilizers. But production of these clean inputs is only just getting started, meaning supply is limited and buying options are scarce. 

Corporate buyers and procurement teams hold the key to changing that. By showing a willingness to pay for cleaner materials and signing longer-term contracts, companies can give suppliers the confidence and financing they need to scale up production. 

Our new report, launched today at #GreenMarketsDay25 at #ClimateWeekNYC, breaks down the tools companies can use to accelerate this transition and illustrates how voluntary buyer action has helped scale other solutions such as CDR technology and sustainable aviation fuel. 

Here’s what RMI’s Josh Henretig had to say: 

""Acting early isn’t just about cutting emissions, it’s a strategic investment. First movers strengthen their brands, secure scarce supply, and help shape the future markets."" 

For more, read our report, Catalytic Procurement: How Corporations Can Lead the Green Commodity Transition, at the link in our bio.","[1] 14. Drive Market For Climate Products And Services","nycw25","[3] Text Graphic","[4] RMI Report","[2] RMI Intelligence",NA,NA,NA,NA,NA,NA,"nycw25"
2025-09-23,"RMI Brand","Facebook",2,3926918,"nycw25",642,0.369,0.056,34,1.267,0.255,0.053,0.514,0.432,13,4,1,0,"RMI Brand","Post","https://www.facebook.com/344520634375161/posts/1262727435887805","Improving efficiency reduces waste, costs, and pollution while still allowing us to meet our needs.  

Delivering fully on the promise of energy efficiency means creating not just better products, buildings, and factories, but upgrading broader systems such as cities, industrial hubs, and global supply chains. Part of that shift will include upgrading from fossil fuel technologies to advanced energy and electrification solutions, which are often two to four times more efficient.  

Coupled with a rapid transition to advanced energy, this holistic approach — evaluating not just a single system but how multiple systems can work better in harmony  — can make the transition faster, more affordable, and more widely beneficial. https://bit.ly/46AV4sG","[3] Digital Illustration","nycw25","[3] Text Graphic","[1] 19. Adoption Of Energy Efficiency & Demand Mgmt","[4] RMI Hub Page","[2] RMI Brand",NA,NA,NA,NA,NA,"nycw25"
2025-09-23,"RMI Brand","Instagram",4,3926918,"nycw25",894,0.01,-0.077,17,-0.105,-0.202,0.019,-0.05,-0.136,NA,1,1,0,"RMI Brand","Post","https://www.instagram.com/p/DO8_Iwvjo86/","Improving efficiency reduces waste, costs, and pollution while still allowing us to meet our needs. 

Delivering fully on the promise of energy efficiency means creating not just better products, buildings, and factories, but upgrading broader systems such as cities, industrial hubs, and global supply chains. Part of that shift will include upgrading from fossil fuel technologies to advanced energy and electrification solutions, which are often two to four times more efficient. 

Coupled with a rapid transition to advanced energy, this holistic approach — evaluating not just a single system but how multiple systems can work better in harmony — can make the transition faster, more affordable, and more widely beneficial. Link in bio for more.","[3] Digital Illustration","nycw25","[3] Text Graphic","[1] 19. Adoption Of Energy Efficiency & Demand Mgmt","[2] RMI Brand","[4] RMI Hub Page",NA,NA,NA,NA,NA,"nycw25"
2025-09-23,"RMI Brand","Twitter",3,3926918,"nycw25",395,-0.268,-0.387,16,-0.448,-0.572,0.041,-0.128,-0.349,13,1,1,0,"RMI Brand","Post","https://twitter.com/RockyMtnInst/status/1970515549114265617","Today’s energy system is incredibly inefficient ― wasting money and resources before any value is created.
 
Improving energy efficiency and deploying advanced energy solutions can cut waste, costs, and pollution while still supporting our needs. https://t.co/3ghv5e1lEx https://t.co/EVvApkiSDf","[3] Digital Illustration","[3] RMIer(s)","[3] Real People","[2] RMI Brand","nycw25","[3] Text Graphic","[1] 19. Adoption Of Energy Efficiency & Demand Mgmt","[4] RMI Hub Page","Amory Lovins",NA,NA,"nycw25"
2025-09-22,"RMI Brand","Facebook",2,3926918,"nycw25",470,0.002,-0.227,14,-0.067,-0.483,0.03,-0.143,-0.189,4,3,1,0,"RMI Brand","Post","https://www.facebook.com/344520634375161/videos/1495781774956284","Construction on the Empire State Building, one of the world’s first supertall buildings, began in 1930. Nearly a century later, the architectural triumph is pushing the frontiers of energy efficiency.  

Empire State Realty Trust and RMI were able to reduce the Empire State Building’s energy consumption by 50% thanks to deep retrofits in the late 2000s. As part of the major upgrade, some 6,500 windows were remanufactured on site, to let in light but reflect heat. By cutting the building’s heating and cooling needs, the improvements helped net $17 million in savings. 

The Empire State Buildings savings offer other cities and states a model to cut waste and pollution in their own buildings: https://bit.ly/3IAhDWs","[4] Watch Video","nycw25","[3] Long Video","[1] 4. Net-Zero Buildings In US","Amory Lovins","[2] RMI Brand",NA,NA,NA,NA,NA,"nycw25"
2025-09-22,"RMI Brand","Twitter",3,3926918,"nycw25",2998,4.557,3.654,59,1.034,0.578,0.02,-0.574,-0.683,44,6,1,0,"RMI Brand","Post","https://twitter.com/RockyMtnInst/status/1970160424067711171","Guided by advice from RMI, deep retrofits to the @empirestatebldg helped @ESRTsocial save $17 million and reduce energy consumption by 50%. 

🏙️ https://t.co/vaZQExuu5W

#ClimateWeekNYC","[1] 4. Net-Zero Buildings In US","[2] RMI Brand","[2] RMI Buildings","[4] Watch Video","nycw25","[3] Long Video","Amory Lovins",NA,NA,NA,NA,"nycw25"
2025-09-18,"RMI Brand","Facebook",2,3926918,"nycw25",1147,1.446,0.887,55,2.667,1.03,0.048,0.371,0.297,17,7,1,0,"RMI Brand","Post","https://www.facebook.com/344520634375161/posts/1258353096325239","🌍 Congratulations to RMI CEO Jon Creyts, recognized today as a global leader in sustainability!  

Forbes’ 2025 Sustainability Leaders List celebrates those who are making bold, innovative, and substantial contributions to sustainability efforts around the world — driving real progress in environmental issues and reshaping industries for a zero-carbon future.  

As the world gathers for #ClimateWeekNYC, this recognition underscores Jon’s vision and commitment to advance market-driven solutions to the climate crisis. At RMI, Jon leads a global portfolio of 300+ projects spanning 50 countries. A few of his career highlights:

• Cofounding Third Derivative, the world’s largest early-stage climate tech accelerator, now home to 268 startups that have raised $2.6 billion to date, to scale gigaton-level climate solutions. 

• Partnering with public and private entities in India to enable over 800 million zero-carbon deliveries via electric 2- and 3-wheel rideshares and courier services. 

• Catalyzing demand for green steel, cement, shipping fuels, and sustainable aviation fuel through buyer coalitions with 75+ leading companies. 

• Pioneering access to clean energy via batteries and solar minigrids in the Caribbean, Nigeria, India, and beyond. 

• Driving innovation with the Global Cooling Prize, resulting in air conditioners that are 5x more efficient and now in production. 

Jon’s recognition reflects not only his vision but also the collective work of RMI and our partners to scale climate solutions at speed. Join us in celebrating Jon’s leadership and the progress being made toward a clean, prosperous, zero-carbon future. 
#ForbesSustainabilityLeaders 
https://bit.ly/3VWl10R","Jon Creyts","[3] RMIer(s)","[3] Real People","[3] Photo","[4] RMI In Media","[2] RMI Brand","nycw25","[3] Text Graphic",NA,NA,NA,"nycw25"
2025-09-18,"RMI Brand","Twitter",3,3926918,"nycw25",1219,1.259,0.892,67,1.31,0.791,0.055,0.17,-0.127,47,3,1,0,"RMI Brand","Post","https://twitter.com/RockyMtnInst/status/1968781855726944361","Congratulations to @Jon_Creyts on being named to the 2025 #ForbesSustainabilityLeaders! @Forbes

As #ClimateWeekNYC begins, this recognition highlights Jon’s leadership in scaling bold, market-driven solutions for a clean, prosperous, zero-carbon future. https://t.co/4pFCArd0Tb https://t.co/ilKbRAvfan","Jon Creyts","[3] RMIer(s)","[3] Real People","[4] RMI In Media","[3] Photo","[2] RMI Brand","nycw25","[3] Text Graphic",NA,NA,NA,"nycw25"
