"created_time","account","post_type","icon","tag_id","tag_name","impressions","impressionsVmedian","impressionsVmean","engagements","engagementsVmedian","engagementsVmean","engagementRate","engrtVmedian","engrtVmean","postClicks","shares","brand","program","accountType","post","perma_link","text","tag1","tag2","tag3","tag4","tag5","tag6","tag7","tag8","tag9","tag10","tag11","campaignID"
2025-03-09,"RMI Brand","LinkedIn",1,3665366,"cera25",3082,1.626,1.113,533,10.34,6.301,0.173,3.023,2.844,469,4,1,0,"RMI Brand","Post","https://linkedin.com/feed/update/urn:li:ugcPost:7303904739400830976","Methane pollution from leaking oil and gas wells is a big problem, but because methane is invisible and odorless, tracking these leaks has been challenging. Now, new methane satellites and advanced sensing technology are changing the game, making it easier to find, track, and stop leaks, and the massive energy waste they represent. 

MethaneSAT and Carbon Mapper both launched their own satellites last year to fill key gaps in detection.  

By identifying leaks, these satellites can not only prevent pollution, they can also help oil and gas operators keep products in the pipeline, saving them money in the long run and consumers money on their heating and electricity bills. 

As we approach #CeraWeek where methane will be center stage, we're taking a look at how satellite tech is helping tackle methane pollution. https://bit.ly/3QQn6ZK","[1] 12. Reduce Methane Leakage In India, China, US​","[4] Internal Article/ Blog","[3] Text Graphic","cera25","[5] Bloomberg Methane","[2] RMI Intelligence",NA,NA,NA,NA,NA,"cera25"
2025-02-21,"RMI Brand","LinkedIn",1,3135076,"[1] 17. Energy Transition Narrative [transition-narrative]",2114,0.801,0.449,92,0.957,0.26,0.044,0.023,-0.022,51,4,1,0,"RMI Brand","Post","https://linkedin.com/feed/update/urn:li:share:7298783294282772480","Countries across the Global South, from Brazil to Morocco, Bangladesh to Egypt, and Namibia to Vietnam, are experiencing rapid growth in solar and wind power generation. With 70% of the world’s renewable energy potential, these regions are taking advantage of their abundant resources at increasingly low cost. When the right incentives are in place, markets respond, and cleantech is on the move. 

In eight countries in sub-Saharan Africa, solar share of electricity is more than twice as high as in the United States. In Pakistan, satellite images in certain areas show solar panels on nearly every building. In Nigeria, efforts to electrify agriculture processes are scaling at speed, providing consistent and affordable electricity to rural farming communities. These examples highlight a broader trend of clean energy expansion at an unprecedented rate. 

Building off RMI’s recent report, Powering Up the Global South, this article breaks down the key data and driving forces of this transition.  

Learn more ➡️ https://bit.ly/419HGZL","[4] Internal Article/ Blog","[2] Global South","[1] 6. Pipeline Of Bankable Global South Projects","[3] Photo","[3] Text Graphic","[1] 17. Energy Transition Narrative [transition-narrative]","[2] RMI Strategy","[1] 5. Transform Utility Biz Models To Support CE In GS",NA,NA,NA,"transition-narrative"
2025-02-05,"RMI Brand","LinkedIn",1,3135076,"[1] 17. Energy Transition Narrative [transition-narrative]",2006,0.709,0.375,99,1.106,0.356,0.049,0.14,0.089,60,2,1,0,"RMI Brand","Post","https://linkedin.com/feed/update/urn:li:share:7292947344608636929","A wide range of industrial applications, from food and beverage production to steelmaking, require on-demand heat, often at temperatures as high as 1,000°C (1,832°F)—or hot enough to melt glass. Slashing carbon pollution from these industrial processes has been a challenge, but thermal batteries may be the solution.

Thermal batteries can charge when electricity is cheapest and cleanest, converting it into heat and storing it for later. This stored heat can then be used to power industrial processes, heating systems, or even serve as backup energy for the electricity grid. 

Learn more about how thermal batteries can accelerate the energy transition and benefit other industries as well:  https://bit.ly/42C1Gqs ","[4] Internal Article/ Blog","[2] RMI Industries","[1] 17. Energy Transition Narrative [transition-narrative]","[3] Figure/ Graph",NA,NA,NA,NA,NA,NA,NA,"transition-narrative"
2025-01-26,"RMI Brand","LinkedIn",1,3135076,"[1] 17. Energy Transition Narrative [transition-narrative]",2185,0.862,0.498,80,0.702,0.096,0.037,-0.14,-0.178,37,3,1,0,"RMI Brand","Post","https://linkedin.com/feed/update/urn:li:share:7289412040153042944","Electricity has taken the lead as the largest supplier of useful energy* — and it has plenty of growth ahead.  

*Useful energy is the total amount of energy left after all processing and conversion losses are accounted for. The fossil fuel system, for example, is incredibly inefficient, wasting about two-thirds of primary energy before it does useful work. 

Learn more: https://bit.ly/4a9oyzc  ","[4] Internal Article/ Blog","[1] 17. Energy Transition Narrative [transition-narrative]","[3] Figure/ Graph","[2] RMI Strategy",NA,NA,NA,NA,NA,NA,NA,"transition-narrative"
2025-01-21,"RMI Brand","LinkedIn",1,3135076,"[1] 17. Energy Transition Narrative [transition-narrative]",1229,0.047,-0.157,35,-0.255,-0.521,0.028,-0.349,-0.378,15,0,1,0,"RMI Brand","Post","https://linkedin.com/feed/update/urn:li:share:7287561351344926720","Energy demand is skyrocketing. Energy efficiency is a solution to help maintain grid reliability for companies and their customers. 

As #WEF25 meets in Davos, the Mission Efficiency Coalition is encouraging business leaders to commit to energy efficiency measures and upgrades that will ensure electricity reliability while also meeting increasing demand and saving money. 

Mission Efficiency has developed a new resource for businesses to ensure energy efficiency is at the top of the agenda at Davos and beyond — with key data points, sector specific summaries of the savings opportunity, and resources for further reading. https://bit.ly/42k54Gb","[3] Text Graphic","[4] External Landing Page","[1] 17. Energy Transition Narrative [transition-narrative]","[2] RMI Strategy",NA,NA,NA,NA,NA,NA,NA,"transition-narrative"
2025-01-18,"RMI Brand","LinkedIn",1,3135076,"[1] 17. Energy Transition Narrative [transition-narrative]",1918,0.634,0.315,62,0.319,-0.151,0.032,-0.256,-0.289,44,0,1,0,"RMI Brand","Post","https://linkedin.com/feed/update/urn:li:share:7286507401216671744","The buildout of renewable energy does not require a surge in capital expenditure (capex). Instead, it can be reallocated: As cleantech capex rises, fossil fuel capex falls.

This reallocation is already underway. In 2015, 35% of energy supply investments went to clean energy. In 2023, 50% of investments were clean, at $1.1 trillion. 

Learn more about how capital is being reallocated to support renewable energy growth: https://bit.ly/3PpJ0SW  ","[4] Internal Article/ Blog","[1] 17. Energy Transition Narrative [transition-narrative]","[3] Figure/ Graph","[2] RMI Strategy",NA,NA,NA,NA,NA,NA,NA,"transition-narrative"
2025-01-10,"RMI Brand","LinkedIn",1,3135076,"[1] 17. Energy Transition Narrative [transition-narrative]",1651,0.407,0.132,64,0.362,-0.123,0.039,-0.093,-0.133,31,2,1,0,"RMI Brand","Post","https://linkedin.com/feed/update/urn:li:share:7283571820803375106","2024 was a record year for clean energy, with falling costs and rising uptake across solar, EVs, and batteries. 

In the new year, there are still more opportunities to transform the energy system, save money, and cut climate pollution: 

➡️ Improving energy efficiency could save trillions of dollars while helping to manage electricity load growth.  

➡️ Slashing methane emissions will be key for tackling climate pollution. New satellites and commitments have made methane more visible, and now it’s time to act.  

➡️ Investments and financing need a reallocation — from fossil fuel subsidies to clean energy solutions. 

We are halfway through this decisive decade and the energy transition has thankfully come a long way. The time is now for leaders and locals around the world to see these signs of progress — and hit the ground running in 2025.  https://bit.ly/3DJynrz ","[4] Internal Article/ Blog","[1] 17. Energy Transition Narrative [transition-narrative]","[3] Figure/ Graph","[2] RMI Strategy",NA,NA,NA,NA,NA,NA,NA,"transition-narrative"
2025-01-04,"RMI Brand","LinkedIn",1,3135076,"[1] 17. Energy Transition Narrative [transition-narrative]",2699,1.3,0.85,144,2.064,0.973,0.053,0.233,0.178,106,4,1,0,"RMI Brand","Post","https://linkedin.com/feed/update/urn:li:share:7281337587221385216","As knowledge grows, technologies improve. On the other hand, mature commodities stay roughly the same. Continuing to develop clean technologies will cut costs and pollution while delivering other benefits. 

For every doubling of deployment, solar and battery prices fall by about 20% — and prices have plummeted, down 99.9% since the 1950s. Batteries prices have fallen by 97% since the 1990s. 

The energy transition can be seen as a shift from dumb commodities to smart technologies. Learn more: https://bit.ly/3ZLlp44 ","[3] Figure/ Graph","[4] RMI Landing Page","[1] 17. Energy Transition Narrative [transition-narrative]","[2] RMI Strategy","[4] Spark Chart",NA,NA,NA,NA,NA,NA,"transition-narrative"
2024-12-31,"RMI Brand","LinkedIn",1,3460970,"Fall Appeal 24",558,-0.524,-0.617,4,-0.915,-0.945,0.007,-0.837,-0.844,3,0,1,0,"RMI Brand","Post","https://linkedin.com/feed/update/urn:li:share:7279839969123123200","⏰ Ends at Midnight: Your Gift to RMI Doubled! 

The stakes for the clean energy transition have never been higher. With technology costs dropping and corporate commitments growing, we have the momentum to drive lasting change. At RMI, we’ve been pioneering this transition for over 40 years, providing data-driven insights and building resilient solutions. 

TODAY is the final day of our year-end match! Every $1 you donate = $2, thanks to generous donors. 

Your support ensures that we remain nimble and responsive to the urgent needs of the clean energy movement. Double your contribution before midnight tonight and power the future of clean energy! 

👉 https://bit.ly/4gspfGg

#CleanEnergy #ClimateAction #YearEndGiving ","[2] RMI Development","[3] Text Graphic","[4] Donate","[4] RMI Landing Page","Fall Appeal 24",NA,NA,NA,NA,NA,NA,"fapp24"
2024-12-29,"RMI Brand","LinkedIn",1,3135076,"[1] 17. Energy Transition Narrative [transition-narrative]",10176,7.671,5.977,713,14.17,8.767,0.07,0.628,0.556,593,8,1,0,"RMI Brand","Post","https://linkedin.com/feed/update/urn:li:share:7279252346046500864","iPods 📈 Walkmans 📉 
Cars 📈 Horses 📉 
Steel 📈 Cast iron 📉 

As new clean technologies achieve S-curve growth, the incumbent technologies retreat along an inverse path, creating an X pattern that is a hallmark of technology evolution. 

Just as cars pushed out horses as the dominant mode of transportation, innovative technologies are transforming the energy system: 

Solar and wind are taking over the electricity supply as they continue to get cheaper, pushing out fossil-fueled electricity. 

Electricity is the new dominant energy carrier, transcending the inefficiencies and pollution from burning fossil fuel molecules. 

Efficient renewable electrification is removing wasteful combustion from the energy system. 

Learn more: https://bit.ly/49LrQbV  ","[1] 17. Energy Transition Narrative [transition-narrative]","[3] Figure/ Graph","[2] RMI Strategy","[4] Spark Chart",NA,NA,NA,NA,NA,NA,NA,"transition-narrative"
2024-12-27,"RMI Brand","LinkedIn",1,3460970,"Fall Appeal 24",514,-0.562,-0.648,5,-0.894,-0.932,0.01,-0.767,-0.778,2,0,1,0,"RMI Brand","Post","https://linkedin.com/feed/update/urn:li:share:7278525055163097090","🎉 Just 5️⃣ days left to make TWICE the difference! 

Join us in building sustainable energy solutions for a clean, prosperous, and zero-carbon future. Through midnight on December 31, every $1 you donate = $2 with a year-end match by generous donors! 

🌟 Double your contribution and help power the future today. 

Make your gift count 👉 https://bit.ly/4ft7ntG

#CleanEnergy #ClimateAction #YearEndGiving","[2] RMI Development","[4] Donate","[3] Text Graphic","[4] RMI Landing Page","Fall Appeal 24",NA,NA,NA,NA,NA,NA,"fapp24"
2024-12-20,"RMI Brand","LinkedIn",1,3460970,"Fall Appeal 24",2737,1.332,0.876,265,4.638,2.63,0.097,1.256,1.156,228,7,1,0,"RMI Brand","Post","https://linkedin.com/feed/update/urn:li:ugcPost:7275717205898444800","🎥 In case you missed it, we're sharing some key moments from our latest webinar. These clips feature insights and stories from Sir Richard Branson, Founder of Virgin Groups, and RMI Managers Ian Welch-Phillips and Taylor Krause, showcasing the importance of our work and why your support matters. 

🌟 Together, we can continue to make a difference. Watch the highlights and join us in driving change by contributing to our fall appeal today! 

👉 https://bit.ly/41ObM7n","[2] RMI Development","[4] Donate","[4] RMI Landing Page","Fall Appeal 24","[3] <2.2 mins Video",NA,NA,NA,NA,NA,NA,"fapp24"
2024-12-10,"RMI Brand","LinkedIn",1,3460970,"Fall Appeal 24",762,-0.351,-0.478,23,-0.511,-0.685,0.03,-0.302,-0.333,8,1,1,0,"RMI Brand","Post","https://linkedin.com/feed/update/urn:li:share:7272329229424295936","🌍 Your Impact TRIPLED for the Next 48 Hours! 🌍 

For the next two days, every $1 donated = $3, thanks to generous donors.  

Here's what that means: 
⚡️A $50 gift becomes $150 
⚡️A $100 gift becomes $300 

⏳ This special match ends at midnight on December 12, 2024, so act now! 

This year, we've seen the dual realities: devastating climate impacts like record-breaking heat and devastating storms AND incredible progress through clean energy solutions like solar power, EVs, and batteries. With your support, we can accelerate this positive momentum and build a clean, affordable energy future. 

🌟 Make your gift today: https://bit.ly/4f4Ddwk
Together, we can scale solutions to protect our planet for generations to come. ","[2] RMI Development","[3] Text Graphic","[4] Post Event/ Webinar","[4] RMI Landing Page","Fall Appeal 24",NA,NA,NA,NA,NA,NA,"fapp24"
2024-12-06,"RMI Brand","LinkedIn",1,3460970,"Fall Appeal 24",2221,0.893,0.523,82,0.745,0.123,0.037,-0.14,-0.178,64,6,1,0,"RMI Brand","Post","https://linkedin.com/feed/update/urn:li:share:7270923218184478720","🌍 Building our Clean Energy Future, Together 🌍 

Join us for an inspiring webinar featuring Sir Richard Branson, Chairman of Virgin Group, in conversation with RMI Managers Taylor Krause and Ian Welch-Phillips. Moderated by RMI Trustee Martha Brooks, this session will explore how the next generation of climate leaders is advancing clean energy solutions worldwide. 

🗓️ Date: Tuesday, December 10, 2024 
⏰ Time: 10 a.m.–11 a.m. MT | 12 p.m.–1 p.m. ET 
📍 Where: Virtual 

✨ Don't miss this exciting opportunity to hear from leaders driving change! 
👉 Register now:  https://bit.ly/3Zrv6o4","[2] RMI Development","[3] Text Graphic","[4] RMI Landing Page","Fall Appeal 24","[4] Pre Event/ Webinar",NA,NA,NA,NA,NA,NA,"fapp24"
2024-12-03,"RMI Brand","LinkedIn",1,3460970,"Fall Appeal 24",900,-0.233,-0.383,36,-0.234,-0.507,0.04,-0.07,-0.111,13,7,1,0,"RMI Brand","Post","https://linkedin.com/feed/update/urn:li:share:7269693868101529600","Clean energy is happening faster than many realize, and RMI is delivering solutions that work for people and the planet. 

This Giving Tuesday, your support helps us continue scaling renewables, advancing energy efficiency, and driving impactful solutions for a zero-carbon future. Please make a gift >> https://bit.ly/4igisRc

We can’t afford to lose momentum when the stakes are so high. This is the mission of all of our lifetimes — and together, we can make it happen!   

#GivingTuesday #CleanEnergy #ClimateAction #Donate ","[2] RMI Development","[3] Text Graphic","[4] RMI Landing Page","Fall Appeal 24",NA,NA,NA,NA,NA,NA,NA,"fapp24"
2024-12-02,"RMI Brand","LinkedIn",1,3300374,"nycw24",1341,0.143,-0.081,33,-0.298,-0.548,0.025,-0.419,-0.444,26,0,1,0,"RMI Brand","Post","https://linkedin.com/feed/update/urn:li:share:7269306813030756352","🏠 🔌 Energy efficiency begins at home — and it’s about more than just appliances. As Michael Gartman from RMI explains, ""The weather that you can expect to see where you live is changing in a pretty unpredictable manner. The benefit of weatherization, unlike some of the other decarbonization measures that you might be thinking about, is it really just shelters you from whatever that change means over time.""

Explore how home weatherization can reduce energy use, lower bills, and prepare your home for efficient upgrades. 🌱💡 https://lnkd.in/gbN55iAQ 

#EnergyEfficiency #Decarbonization #SustainableLiving #RMI #ClimateAction  ","[3] Stock","[2] RMI Buildings","[1] 19. Adoption Of Energy Efficiency & Demand Mgmt","[4] RMI In Media","nycw24",NA,NA,NA,NA,NA,NA,"nycw24"
2024-11-30,"RMI Brand","LinkedIn",1,3422947,"COP29",1854,0.58,0.271,55,0.17,-0.247,0.03,-0.302,-0.333,33,4,1,0,"RMI Brand","Post","https://linkedin.com/feed/update/urn:li:share:7268744858633199616","Emissions from existing coal power plants will push global warming beyond 1.5°C. Countries need to immediately end the construction of new coal power plants and phase out existing ones completely by 2040. With 85% of coal demand coming from emerging economies, it’s vital to accelerate the coal-to-clean transition across the developing world.  

The phase-out of coal power is well underway in certain regions, but accelerating the coal-to-clean transition across developing economies is the best way to achievethat goal. This is challenging work, and will depend on domestic policy and planning, plus the support of international partners, local stakeholder support, and raising the ambition of both private and public financial commitments. 

""Accelerating Coal-to-Clean Energy Transitions: First Report and Recommendations of the Coal Transition Commission,"" authored by the International Energy Agency (IEA), The Powering Past Coal Alliance (PPCA), E3G, Glasgow Financial Alliance for Net Zero (GFANZ), and RMI, and supported by Bloomberg Philanthropies, is a roadmap that shows the opportunities, challenges, and financial and policy solutions to speed up the transition away from coal to clean energy: https://bit.ly/48N9wOV","[1] 8. Support US Electric Facilities In Biz Planning","[2] RMI Electricity","COP29","[3] Text Graphic","[4] External Landing Page","[3] RMIer(s)",NA,NA,NA,NA,NA,"cop29"
2024-11-29,"RMI Brand","LinkedIn",1,3422947,"COP29",1319,0.124,-0.096,38,-0.191,-0.479,0.029,-0.326,-0.356,17,2,1,0,"RMI Brand","Post","https://linkedin.com/feed/update/urn:li:share:7268168060400787457","Cleantech and renewable energy are vital for slashing greenhouse gas (GHG) emissions. These technologies rely on minerals and metals that must be extracted, used, and disposed of responsibly. To limit harmful pollution, warming emissions, excessive water use, and other damage to communities and ecosystems, we must manage these resources sustainably 

The minerals and metals used in cleantech provide an opportunity  to do so, and move away from an entirely extractive energy economy: 

""Unlike fossil fuels, the materials used for batteries, solar cells and wind turbines offer enormous economic potential for reuse. Remarkably, the cumulative mass of materials needed to support the clean energy transition through 2050 is less than the amount of coal currently extracted each year,"" RMI CEO Jon Creyts told World Economic Forum. ""By re-engineering material flows, we can keep scarce high-value resources in circulation and reduce our dependence on ongoing extraction.""

Learn more from 14 experts who spoke with WEF about how to responsibly use resources as the energy transition accelerates: https://bit.ly/4fOn1Ro ","COP29","Jon Creyts","[3] Text Graphic","[4] RMI In Media",NA,NA,NA,NA,NA,NA,NA,"cop29"
2024-11-28,"RMI Brand","LinkedIn",1,3422947,"COP29",1743,0.485,0.195,218,3.638,1.986,0.125,1.907,1.778,210,0,1,0,"RMI Brand","Post","https://linkedin.com/feed/update/urn:li:ugcPost:7265850042840715264","When organic waste – like food scraps, yard clippings, and cardboard – breaks down in landfills and dumpsites around the world, it creates methane, a climate super pollutant with over 80 times the near-term warming power of carbon dioxide. 

Thankfully, there are proven, cost-effective strategies to reduce and recycle organic waste and strengthen emission controls at disposal sites that could curb nearly 90 percent of methane emissions from solid waste.  

More than 30 countries at #COP29 signed on to set specific targets to reduce waste sector methane and develop new policies and programs to achieve those targets. Focusing on the waste sector is essential to achieve the Global Methane Pledge’s goal to cut methane by 30% below 2020 levels, by 2030, limit near-term temperature rise, and avoid dangerous climate tipping points. Quick action means benefits today: since methane is released alongside other harmful pollutants, addressing methane from organic waste will also protect public health, improve air quality, and advance environmental justice. https://bit.ly/4eIDuF9","[1] 12. Reduce Methane Leakage In India, China, US​","COP29","[4] Internal Article/ Blog","[3] Text Graphic","[2] RMI Policy",NA,NA,NA,NA,NA,NA,"cop29"
2024-11-27,"RMI Brand","LinkedIn",1,3422947,"COP29",3513,1.994,1.408,290,5.17,2.973,0.083,0.93,0.844,223,10,1,0,"RMI Brand","Post","https://linkedin.com/feed/update/urn:li:ugcPost:7267424588899196929","Our existing fossil fuel energy system is surprisingly inefficient: It wastes about two-thirds of the primary energy that’s put into it. When you add up the numbers, that’s about $4.5 trillion in waste every year. 

Energy efficiency should be our ""first fuel"" to enhance the energy system. Greater efficiency can help us get more out of our existing energy infrastructure, which would strengthen energy security, lower costs, cut emissions, and ultimately speed the shift to lower-carbon energy sources. 

RMI CEO Jon Creyts joined The Energy Gang to discuss the need for leadership around the world to commit to improving energy efficiency: https://bit.ly/4eM91WL","Jon Creyts","[4] External Landing Page","[3] RMIer(s)","[3] Real People","[4] RMI In Media","COP29","[1] 19. Adoption Of Energy Efficiency & Demand Mgmt","[3] <2.2 mins Video",NA,NA,NA,"cop29"
2024-11-23,"RMI Brand","LinkedIn",1,3460970,"Fall Appeal 24",9603,7.183,5.584,588,11.511,7.055,0.061,0.419,0.356,434,44,1,0,"RMI Brand","Post","https://linkedin.com/feed/update/urn:li:share:7266154292116414464","Cleaner air and water. New and growing job opportunities. Communities built to withstand climate impacts. A clean energy future is within reach, but it will take all of us working together to make it happen. 

Join Sir Richard Branson, Chairman of Virgin Group, alongside RMI's Taylor Krause and Ian Welch-Phillips, for an engaging webinar moderated by RMI Trustee Martha Brooks. We’ll discuss how to activate the next generation of climate leaders and the power of partnerships to drive forward clean energy solutions worldwide. 

📆: Tuesday, December 10, 2024 
⏰: 10–11 a.m. MT / 12–1 p.m. ET 

👉 Register now: https://bit.ly/3OlQ9TL

Together, let’s build a cleaner, resilient future. 🌍✨ 

#CleanEnergy #SustainableFuture","[3] Text Graphic","[4] Pre Event/ Webinar","Fall Appeal 24","[2] RMI Brand",NA,NA,NA,NA,NA,NA,NA,"fapp24"
2024-11-22,"RMI Brand","LinkedIn",1,3422947,"COP29",1323,0.127,-0.093,37,-0.213,-0.493,0.028,-0.349,-0.378,19,2,1,0,"RMI Brand","Post","https://linkedin.com/feed/update/urn:li:share:7265842234577559554","As #COP29 draws to a close, the need for actionable solutions across high-emission sectors is clearer than ever. The steel industry, a major driver of economic and social development, is also one of the most energy-intensive sectors, emitting roughly 7% of global pollution. In China, steel’s share of emissions is even higher, accounting for around 16% of the annual total. Accelerating the deployment of near-zero-carbon steel projects is essential to achieve global climate goals and presents an opportunity for high-quality, sustainable growth within the industry.  

RMI’s latest report, Unlocking the First Wave of Breakthrough Steel Investments in China, provides an in-depth analysis of the economic pathways for the steel industry's shift to near-zero emissions in China. The report examines how stakeholders — including policymakers, demand-side buyers, and financial institutions — can facilitate this transition. It also offers six recommendations aimed at expediting the transition process. 

Read the full report here: https://bit.ly/3B3kzXP","[1] 7. Shift To Majority-Renewable New Supply In China","[1] 14. Drive Market For Climate Products And Services","[2] RMI China","COP29","[4] RMI Report","[3] Photo",NA,NA,NA,NA,NA,"cop29"
