"created_time","account","post_type","icon","tag_id","tag_name","impressions","impressionsVmedian","impressionsVmean","engagements","engagementsVmedian","engagementsVmean","engagementRate","engrtVmedian","engrtVmean","postClicks","shares","brand","program","accountType","post","perma_link","text","tag1","tag2","tag3","tag4","tag5","tag6","tag7","tag8","tag9","tag10","tag11","campaignID"
2024-11-28,"RMI Brand","Facebook",2,3422947,"COP29",339,-0.277,-0.442,11,-0.267,-0.594,0.032,-0.086,-0.135,3,2,1,0,"RMI Brand","Post","https://www.facebook.com/344520634375161/posts/1021080210052530","When organic waste – like food scraps, yard clippings, and cardboard – breaks down in landfills and dumpsites around the world, it creates methane, a climate super pollutant with over 80 times the near-term warming power of carbon dioxide. 

Thankfully, there are proven, cost-effective strategies to reduce and recycle organic waste and strengthen emission controls at disposal sites that could curb nearly 90 percent of methane emissions from solid waste.  

More than 30 countries at #COP29 signed on to set specific targets to reduce waste sector methane and develop new policies and programs to achieve those targets. Focusing on the waste sector is essential to achieve the Global Methane Pledge’s goal to cut methane by 30% below 2020 levels, by 2030, limit near-term temperature rise, and avoid dangerous climate tipping points. Quick action means benefits today: since methane is released alongside other harmful pollutants, addressing methane from organic waste will also protect public health, improve air quality, and advance environmental justice. https://bit.ly/3V4HvNm","[4] Internal Article/ Blog","[1] 12. Reduce Methane Leakage In India, China, US​","COP29","[3] Text Graphic","[2] RMI Policy",NA,NA,NA,NA,NA,NA,"cop29"
2024-11-28,"RMI Brand","Twitter",3,3422947,"COP29",742,0.375,0.152,24,-0.172,-0.358,0.032,-0.319,-0.492,2,6,1,0,"RMI Brand","Post","https://twitter.com/RockyMtnInst/status/1862145980612657543","Methane, a powerful greenhouse gas, is created when organic waste breaks down in landfills, but there are proven ways to reduce these methane emissions. 

Countries at #COP29 signed on to develop targets and strategies to reduce waste sector methane: https://t.co/6Fe3FqKrHx https://t.co/vExgS1HiF0","COP29","[1] 12. Reduce Methane Leakage In India, China, US​","[4] Internal Article/ Blog","[3] Text Graphic","[2] RMI Policy",NA,NA,NA,NA,NA,NA,"cop29"
2024-11-27,"RMI Africa","Twitter",3,3422947,"COP29",180,-0.011,0.082,11,-0.083,0.028,0.061,0.13,0.109,4,2,0,1,"RMI Program","Post","https://twitter.com/RMIAfrica/status/1861838904883605792","For #COP29 Gender Day, RMI’s Energy Transition Academy joined with the Africa Minigrids Program (AMP), @SEforALLorg, @CFANadvisors, and energy leaders to discuss the vital role of women in driving the energy transition.

Missed the discussion? Watch here: 
https://t.co/MB2UFsWfm3","[1] 13. Empower Leaders To Fast-Track Clean Energy Trans","COP29","[2] RMI Africa","[4] Post Event/ Webinar","[2] Global South","[3] No creative",NA,NA,NA,NA,NA,"cop29"
2024-11-27,"RMI Brand","Twitter",3,3422947,"COP29",741,0.373,0.15,21,-0.276,-0.439,0.028,-0.404,-0.556,18,2,1,0,"RMI Brand","Post","https://twitter.com/RockyMtnInst/status/1861582568686047303","RMI CEO @Jon_Creyts spoke with @TheEnergyGang about how improving the efficiency of our existing energy system can strengthen energy security, cut emissions, lower costs, and support the energy transition: https://t.co/WEaCWrH7CP https://t.co/rjzoGRjz9K","Jon Creyts","[4] External Landing Page","[3] RMIer(s)","[3] Real People","[4] RMI In Media","COP29","[1] 19. Adoption Of Energy Efficiency & Demand Mgmt","[3] <2.2 mins Video",NA,NA,NA,"cop29"
2024-11-27,"RMI Brand","Facebook",2,3422947,"COP29",187,-0.601,-0.692,17,0.133,-0.373,0.091,1.6,1.459,3,4,1,0,"RMI Brand","Post","https://www.facebook.com/344520634375161/videos/925715299501152","Our existing fossil fuel energy system is surprisingly inefficient: It wastes about two-thirds of the primary energy that’s put into it. When you add up the numbers, that’s about $4.5 trillion in waste every year. 

Energy efficiency should be our ""first fuel"" to enhance the energy system. Greater efficiency can help us get more out of our existing energy infrastructure, which would strengthen energy security, lower costs, cut emissions, and ultimately speed the shift to lower-carbon energy sources. 

RMI CEO Jon Creyts joined The Energy Gang to discuss the need for leadership around the world to commit to improving energy efficiency: https://bit.ly/4eM91WL","[4] External Landing Page","Jon Creyts","[3] RMIer(s)","[3] Real People","[4] RMI In Media","COP29","[1] 19. Adoption Of Energy Efficiency & Demand Mgmt","[3] <2.2 mins Video",NA,NA,NA,"cop29"
2024-11-23,"RMI Brand","Facebook",2,3460970,"Fall Appeal 24",832,0.774,0.368,38,1.533,0.402,0.046,0.314,0.243,18,4,1,0,"RMI Brand","Post","https://www.facebook.com/344520634375161/posts/1017161260444425","Cleaner air and water. New and growing job opportunities. Communities built to withstand climate impacts. A clean energy future is within reach, but it will take all of us working together to make it happen. 

Join Sir Richard Branson, Chairman of Virgin Group, alongside RMI's Taylor Krause and Ian Welch-Phillips, for an engaging webinar moderated by RMI Trustee Martha Brooks. We’ll discuss how to activate the next generation of climate leaders and the power of partnerships to drive forward clean energy solutions worldwide. 

📆: Tuesday, December 10, 2024 
⏰: 10–11 a.m. MT / 12–1 p.m. ET 

👉 Register now: https://bit.ly/4eEEES1

Together, let’s build a cleaner, resilient future. 🌍✨ 

#CleanEnergy #SustainableFuture","[3] Text Graphic","[4] Pre Event/ Webinar","Fall Appeal 24","[2] RMI Brand",NA,NA,NA,NA,NA,NA,NA,"fapp24"
2024-11-23,"RMI Brand","Twitter",3,3460970,"Fall Appeal 24",1145,1.122,0.777,50,0.724,0.337,0.044,-0.064,-0.302,16,2,1,0,"RMI Brand","Post","https://twitter.com/RockyMtnInst/status/1860390389544296652","Cleaner air. Good jobs. Resilient communities. 🌍 

Join @RichardBranson, RMI’s @taylorkrauseee &amp; Ian Welch-Phillips, and moderator Martha Brooks for our annual webinar on empowering the next generation of climate leaders.

👉 Register here: https://t.co/QXnhuHPpTh https://t.co/qp6BrLOFic","[3] Text Graphic","Fall Appeal 24","[4] Pre Event/ Webinar","[2] RMI Brand",NA,NA,NA,NA,NA,NA,NA,"fapp24"
2024-11-22,"RMI Brand","Facebook",2,3422947,"COP29",139,-0.704,-0.771,3,-0.8,-0.889,0.022,-0.371,-0.405,0,1,1,0,"RMI Brand","Post","https://www.facebook.com/344520634375161/videos/1258323481923491","On Gender Day at #COP29, RMI’s Energy Transition Academy (ETA) hosted a virtual roundtable —featuring women leaders from around the world — on the critical role of women’s leadership in advancing renewable energy projects across the Caribbean, India, the Pacific, and Sub-Saharan Africa. 

The webinar underscored the importance of inclusive leadership in creating clean energy solutions, emphasizing that diverse perspectives are essential for sound decision-making and effective climate action. Despite the different geographies represented in the panel, “there are so many common threads in our paths”, noted Nitisha Agrawal, founder of the Smokeless Cookstove Foundation in India. “Forums like these establish community and a common shared hope and vision. Our problems, our solutions, are not so different from women in other regions.”  

The discussions highlighted the experiences and stories of women energy leaders advancing renewable energy projects in their countries, and the importance of capacity building and mentorship programs to support career growth. “Great opportunities are not out of reach, as long as they are visible to us,” panelist TeAnn Thomas added, “as the climate space is still evolving, there’s always new opportunities to explore and each of us has a role to play in making these visible for the next generation of energy leaders.” TeAnn spoke from experience, as she is an alumnus of both the ETA Global Caribbean Fellowship Program and the WIRE Network.  

Joining RMI’s Amber Zirnhelt and Valentina Guido on the roundtable were Nitisha Agrawal, Smokeless Cookstove Foundation and Clean Cooking Mentorship Program hosted by SE4All, Clean Cooking Alliance and Global Women Network for the Energy Transition; Sauda Bobboi, Rural Electrification Agency, Nigeria and Africa Minigrids Project; Nnyeka Prescod, Climate Finance Access Network (CFAN); and TeAnn Thomas, Turks and Caicos Islands Government and WIRE.  

The webinar built on the vision of centering gender and women empowerment in the climate agenda at COP and globally, as well as on the momentum of the WIRE Network’s recent convening in Barbados, where women leaders came together to strategize on advancing sustainable energy solutions across the Caribbean. Watch the video to gain insights into their collaboration and impact. 

🌱 If you missed the webinar, you can watch the full discussion here: https://bit.ly/3V666kG","[1] 13. Empower Leaders To Fast-Track Clean Energy Trans","[4] Post Event/ Webinar","[2] Global South","[4] Watch Video","COP29","[1] 17. Energy Transition Narrative [transition-narrative]",NA,NA,NA,NA,NA,"cop29"
2024-11-22,"RMI Brand","Twitter",3,3422947,"COP29",791,0.466,0.228,49,0.69,0.31,0.062,0.319,-0.016,26,1,1,0,"RMI Brand","Post","https://twitter.com/RockyMtnInst/status/1860031264352293358","The steel industry is one of the largest industrial emitters, producing 7% of global emissions and 16% of China’s emissions. RMI’s report offers an analysis of the economic pathways for China’s steelmakers to transition to near-zero emissions.

Learn more: https://t.co/w2yIGBLqjv https://t.co/RvpgWh8Dik","[1] 7. Shift To Majority-Renewable New Supply In China","[2] RMI China","[1] 14. Drive Market For Climate Products And Services","COP29","[4] RMI Report","[3] Photo",NA,NA,NA,NA,NA,"cop29"
2024-11-22,"RMI Brand","Facebook",2,3422947,"COP29",268,-0.429,-0.559,6,-0.6,-0.779,0.022,-0.371,-0.405,0,2,1,0,"RMI Brand","Post","https://www.facebook.com/344520634375161/posts/1016426677184550","As #COP29 draws to a close, the need for actionable solutions across high-emission sectors is clearer than ever. The steel industry, a major driver of economic and social development, is also one of the most energy-intensive sectors, emitting roughly 7% of global pollution. In China, steel’s share of emissions is even higher, accounting for around 16% of the annual total. Accelerating the deployment of near-zero-carbon steel projects is essential to achieve global climate goals and presents an opportunity for high-quality, sustainable growth within the industry.  

RMI’s latest report provides an in-depth analysis of the economic pathways for the steel industry's shift to near-zero emissions in China. The report examines how stakeholders — including policymakers, demand-side buyers, and financial institutions — can facilitate this transition. It also offers six recommendations aimed at expediting the transition process. 

Read the full report here: https://bit.ly/48Z1EtO","[1] 7. Shift To Majority-Renewable New Supply In China","[2] RMI China","[1] 14. Drive Market For Climate Products And Services","COP29","[4] RMI Report","[3] Photo",NA,NA,NA,NA,NA,"cop29"
2024-11-22,"RMI Brand","Twitter",3,3422947,"COP29",608,0.127,-0.056,16,-0.448,-0.572,0.026,-0.447,-0.587,9,0,1,0,"RMI Brand","Post","https://twitter.com/RockyMtnInst/status/1860013377885454680","On Gender Day at #COP29, RMI’s Energy Transition Academy hosted a roundtable featuring women leaders driving renewable energy all across the globe. The webinar emphasized the importance of inclusive leadership for effective climate action.

Watch here: https://t.co/Vm2AWstVLt","[1] 13. Empower Leaders To Fast-Track Clean Energy Trans","COP29","[4] Post Event/ Webinar","[1] 17. Energy Transition Narrative [transition-narrative]","[2] Global South","[3] No creative",NA,NA,NA,NA,NA,"cop29"
2024-11-21,"RMI Brand","Instagram",4,3422947,"COP29",1169,0.321,0.207,36,0.895,0.69,0.031,0.55,0.409,NA,2,1,0,"RMI Brand","Post","https://www.instagram.com/p/DCngcaKJfAA/","🌍 As #COP29 drives global conversations this week on clean energy, India is leading with bold climate ambitions. How can India’s road transport sector speed up its #CleanEnergy transition? Our new report, ""India at 2047: A Vision for Energy Independence in the Mobility Sector,"" outlines a clear path forward. 

By 2047, India aims for a fully self-reliant energy landscape. This report lists actionable steps and targets to make this a reality, supporting the worldwide move toward sustainable transport highlighted at COP29. 

Discover the path to India’s clean energy future through the link in our bio.","[1] 13. Empower Leaders To Fast-Track Clean Energy Trans","[2] RMI Transportation","[4] RMI Report","[2] RMI India","[3] Figure/ Graph","COP29","[3] Text Graphic","[1] 1. Accelerate Adoption Of Electric 2/3 Wheelers Globally","[1] 19. Adoption Of Energy Efficiency & Demand Mgmt",NA,NA,"cop29"
2024-11-20,"RMI Brand","Facebook",2,3422947,"COP29",210,-0.552,-0.655,7,-0.533,-0.742,0.033,-0.057,-0.108,3,2,1,0,"RMI Brand","Post","https://www.facebook.com/344520634375161/posts/1014931327334085","🌍 At #COP29 this week, nations are advancing discussions on their clean energy transitions, and India stands ready with ambitious climate goals. A recent RMI report, India at 2047: A Vision for Energy Independence in the Mobility Sector, charts the road ahead. 

By 2047, India is aiming to fully transform its mobility landscape. This report calculates the required #CleanEnergy vehicle adoption levels and provides actionable solutions that can help to achieve these targets supporting the global shift toward sustainable transport emphasized at COP29. 

Read the full report and discover how India can drive its clean mobility future: https://bit.ly/4fytDD5","[1] 13. Empower Leaders To Fast-Track Clean Energy Trans","[1] 2. Facilitate Investment In EV Infrastructure","[4] RMI Report","[2] RMI India","[3] Figure/ Graph","COP29","[1] 1. Accelerate Adoption Of Electric 2/3 Wheelers Globally",NA,NA,NA,NA,"cop29"
2024-11-20,"RMI Brand","Twitter",3,3422947,"COP29",487,-0.097,-0.244,9,-0.69,-0.759,0.018,-0.617,-0.714,5,0,1,0,"RMI Brand","Post","https://twitter.com/RockyMtnInst/status/1859295164361052289","🌍 At #COP29, countries are advancing #CleanEnergy goals — and India is ready for ambitious action. RMI’s report, India at 2047: A Vision for Energy Independence in Mobility, charts India's path to a transformed energy future. 🇮🇳 

Read more: https://t.co/0aOw1ik9Uz https://t.co/Zyd8pPlM3a","[1] 13. Empower Leaders To Fast-Track Clean Energy Trans","[1] 2. Facilitate Investment In EV Infrastructure","[4] RMI Report","[3] Figure/ Graph","[2] RMI India","COP29","[1] 1. Accelerate Adoption Of Electric 2/3 Wheelers Globally",NA,NA,NA,NA,"cop29"
2024-11-20,"RMI Brand","Twitter",3,3422947,"COP29",869,0.611,0.349,27,-0.069,-0.278,0.031,-0.34,-0.508,18,4,1,0,"RMI Brand","Post","https://twitter.com/RockyMtnInst/status/1859046000205189249","In the era of artificial intelligence (#AI), the data-center boom is driving significant increases in energy consumption. RMI's report examines China’s sustainable data-center growth strategies to balance AI's rise with global climate goals. 

Full report: https://t.co/iGzOpUfKKp","[1] 7. Shift To Majority-Renewable New Supply In China","[1] 14. Drive Market For Climate Products And Services","[2] RMI China","COP29","[4] RMI Report","[3] Figure/ Graph",NA,NA,NA,NA,NA,"cop29"
2024-11-20,"RMI Brand","Facebook",2,3422947,"COP29",146,-0.689,-0.76,5,-0.667,-0.815,0.034,-0.029,-0.081,2,1,1,0,"RMI Brand","Post","https://www.facebook.com/344520634375161/posts/1014365870723964","This week at the #COP29 China Pavilion Side Event, RMI released the report, Powering the Data-Center Boom with Low-Carbon Solutions: China’s Perspective and Global Insights. The release spotlights China's innovation in driving sustainable growth for the data-center industry on a global scale. 
 
In the era of artificial intelligence (AI), the rising demand for data centers is leading to substantial increases in energy use and carbon emissions. This emerging challenge must be met with forward-thinking solutions that will both harness AI’s potential and have minimal impact to our planet.  

The report maps out the challenges of reducing emissions while China’s data centers grow rapidly, and offers strategies to do so sustainably. 

Read the full report here: https://bit.ly/4fxLhXI","[1] 7. Shift To Majority-Renewable New Supply In China","[1] 14. Drive Market For Climate Products And Services","[2] RMI China","COP29","[4] RMI Report","[3] Figure/ Graph",NA,NA,NA,NA,NA,"cop29"
2024-11-19,"RMI Brand","Instagram",4,3422947,"COP29",945,0.068,-0.025,42,1.211,0.972,0.044,1.2,1,NA,9,1,0,"RMI Brand","Post","https://www.instagram.com/p/DCjxNIKuJyQ/","🌍 #COP29 Clips: Agriculture is the lifeline for millions of Nigerians. Farming forms the backbone of Nigeria’s economy, and for many is the very fabric of cultural identity. 

🚜 RMI’s Ayodeji (Deji) Ojo, senior associate of the Africa Energy Program, discusses the importance of adapting Nigeria’s agricultural practices and incorporating renewables in the face of a changing climate.","[4] Internal Article/ Blog","[2] RMI Africa","[3] RMIer(s)","[2] Global South","[3] Real People","[3] Photo","COP29","[1] 1. Accelerate Adoption Of Electric 2/3 Wheelers Globally","[1] 17. Energy Transition Narrative [transition-narrative]","[1] 19. Adoption Of Energy Efficiency & Demand Mgmt",NA,"cop29"
2024-11-19,"RMI Brand","Facebook",2,3422947,"COP29",211,-0.55,-0.653,1,-0.933,-0.963,0.005,-0.857,-0.865,0,0,1,0,"RMI Brand","Post","https://www.facebook.com/344520634375161/posts/1014054830755068","🌍 COP29 Clips: From the cacao and oil palm plantations of the south to the expansive fields of livestock in the north, farming forms the backbone of Nigeria’s economy and the lifeblood of its rural communities. Now, as a changing climate threatens the country’s agricultural landscape through intensifying droughts and unpredictable rainfall, farmers must quickly adapt. 

RMI’s Energizing Agriculture Program supports these farmers by electrifying their processes, solar-powered mills and refrigerators, and electric two-wheelers. At the intersection of Nigeria’s agriculture and its transition to renewable energy stands Ayodeji (Deji) Ojo, a senior associate on RMI’s Africa Energy Program.  
 
Deji’s roots run deep in the agricultural communities of rural Nigeria. Growing up in a semi-urban community in Osun State, Deji learned at an early age the importance of farming and the devastating impacts that a changing climate can have on farmers’ livelihoods. Deji found RMI after researching innovative solutions for agricultural communities. He now champions our initiatives to electrify agricultural processing equipment and deploy electric two-wheelers for farm logistics. 

Read his remarkable story, and learn how Deji is electrifying agriculture throughout Nigeria: https://bit.ly/3ZcKoOu","[4] Internal Article/ Blog","[2] RMI Africa","[3] RMIer(s)","[2] Global South","[3] Real People","[3] Photo","COP29","[1] 1. Accelerate Adoption Of Electric 2/3 Wheelers Globally","[1] 19. Adoption Of Energy Efficiency & Demand Mgmt",NA,NA,"cop29"
2024-11-19,"RMI Brand","Twitter",3,3422947,"COP29",585,0.084,-0.092,16,-0.448,-0.572,0.027,-0.426,-0.571,9,2,1,0,"RMI Brand","Post","https://twitter.com/RockyMtnInst/status/1858809966464799034","🌍 #COP29 Clips: Agriculture is the lifeline for millions of Nigerians. RMI’s Ayodeji (Deji) Ojo discusses the importance of adapting Nigeria’s agricultural practices in the face of a changing climate. Read his remarkable story here: https://t.co/W5RVhT2oQe 🌱 https://t.co/66kEDVodk8","[4] Internal Article/ Blog","[2] RMI Africa","[3] RMIer(s)","[3] Real People","[2] Global South","[3] Photo","COP29","[1] 17. Energy Transition Narrative [transition-narrative]","[1] 1. Accelerate Adoption Of Electric 2/3 Wheelers Globally","[1] 19. Adoption Of Energy Efficiency & Demand Mgmt",NA,"cop29"
2024-11-18,"RMI Brand","Twitter",3,3422947,"COP29",966,0.791,0.5,43,0.483,0.15,0.045,-0.043,-0.286,18,2,1,0,"RMI Brand","Post","https://twitter.com/RockyMtnInst/status/1858481552570589526","Pursuing energy efficiency is in everyone’s interest. Efficiency is the largest, cheapest, and most beneficial lever to drive down emissions, boost resilience, and meet energy demand equitably and affordably. 

More from RMI CEO @Jon_Creyts: https://t.co/aSE5i23KmV https://t.co/599NGz76ir","COP29","[3] Text Graphic","[3] RMIer(s)","[1] 19. Adoption Of Energy Efficiency & Demand Mgmt","[4] RMI In Media",NA,NA,NA,NA,NA,NA,"cop29"
2024-11-18,"RMI Brand","Facebook",2,3422947,"COP29",614,0.309,0.01,27,0.8,-0.004,0.044,0.257,0.189,3,5,1,0,"RMI Brand","Post","https://www.facebook.com/344520634375161/posts/1013108120849739","Leaders around the world would benefit from focusing on improving energy efficiency as part of their climate goals. Energy efficiency is the largest, cheapest, and most beneficial lever to drive down emissions and meet energy demand equitably, and affordably.

According to the International Energy Agency (IEA), energy efficiency could account for nearly half of the emissions reductions needed by 2030 to achieve Paris goals to reach net zero by 2050. By saving energy through efficient technologies and smarter systems across buildings, transport, and industry, the world can avoid climate pollution and save trillions, while boosting resilience for all. 

More from RMI CEO Jon Creyts on why pursuing energy efficiency is in everyone’s interest: https://bit.ly/4fP2WcW","COP29","[3] Text Graphic","[3] RMIer(s)","[4] RMI In Media","[1] 19. Adoption Of Energy Efficiency & Demand Mgmt",NA,NA,NA,NA,NA,NA,"cop29"
2024-11-17,"RMI Brand","Facebook",2,3460970,"Fall Appeal 24",406,-0.134,-0.332,8,-0.467,-0.705,0.02,-0.429,-0.459,0,1,1,0,"RMI Brand","Post","https://www.facebook.com/344520634375161/posts/1012857890874762","🌍 The impacts of climate change are being felt worldwide. But there’s hope. RMI is driving solutions that can cut emissions and help deliver a sustainable future for all of us. From deploying solar + battery systems for health clinics in Barbados to cool-roof technologies in India, we’re building a brighter, cleaner tomorrow. But we can’t do it alone. 

🔋 Every $1 donated = $2 with our match! Through Dec. 31, gifts will be doubled. Let’s turn today’s climate challenges into tomorrow’s solutions — together. 

Donate now to double your impact ➡️  https://bit.ly/3ZbJ8LF

#FallAppeal #ClimateAction #CleanEnergy","[3] Text Graphic","[4] RMI Landing Page","Fall Appeal 24","[2] RMI Brand",NA,NA,NA,NA,NA,NA,NA,"fapp24"
2024-11-17,"RMI Brand","Twitter",3,3460970,"Fall Appeal 24",1092,1.024,0.695,39,0.345,0.043,0.036,-0.234,-0.429,23,5,1,0,"RMI Brand","Post","https://twitter.com/RockyMtnInst/status/1858257581849924002","Help RMI turn today’s climate challenges into tomorrow’s solutions! Every $1 donated = $2 through Dec. 31, thanks to a generous match up to $115K. Support clean energy innovation that powers a sustainable future for all 🌎 

Donate now ➡️ https://t.co/ZvHKhj14BS

#ClimateAction https://t.co/M0CltcGsy6","[3] Text Graphic","[4] RMI Landing Page","Fall Appeal 24","[2] RMI Brand",NA,NA,NA,NA,NA,NA,NA,"fapp24"
2024-11-16,"RMI Brand","Twitter",3,3422947,"COP29",1219,1.259,0.892,33,0.138,-0.118,0.027,-0.426,-0.571,14,5,1,0,"RMI Brand","Post","https://twitter.com/RockyMtnInst/status/1857821341178540183","China leads the world in climate tech investment, with startups driving innovation for carbon neutrality. Despite their crucial role, these startups face financial challenges. RMI’s latest report explores solutions to support their growth. https://t.co/TPtlXF0aKT

#ClimateTech https://t.co/aki2rDb7Ic","[1] 7. Shift To Majority-Renewable New Supply In China","[2] RMI China","COP29","[4] RMI Report","[3] Text Graphic","[3] Photo",NA,NA,NA,NA,NA,"cop29"
2024-11-16,"RMI Brand","Facebook",2,3422947,"COP29",328,-0.301,-0.461,6,-0.6,-0.779,0.018,-0.486,-0.514,1,1,1,0,"RMI Brand","Post","https://www.facebook.com/344520634375161/posts/1011925257634692","This year at #COP29, climate technology and climate financing took center stage. China leads the world in investment in this area, with climate tech startups driving innovation and advancing climate solutions. However, due to uncertainties in growth prospects and a weak credit system, these startups are disadvantaged in the financial market, hindering their development potential.  

RMI’s latest report provides an in-depth analysis of the current state of climate technology in China and identifies the financing challenges faced by China’s climate tech startup. The report also proposes three strategies to optimize financing:

- Develop scientific evaluation models to accurately measure carbon-related returns 
- Facilitate platform development to break down information barriers and streamline resource allocation 
- Innovate financial products to mitigate risks for investors and expand financing options for startups 

Read the full report to learn more:
https://bit.ly/3Ocpxo6","[1] 7. Shift To Majority-Renewable New Supply In China","[2] RMI China","COP29","[4] RMI Report","[3] Text Graphic","[3] Photo",NA,NA,NA,NA,NA,"cop29"
