"created_time","account","post_type","icon","tag_id","tag_name","impressions","impressionsVmedian","impressionsVmean","engagements","engagementsVmedian","engagementsVmean","engagementRate","engrtVmedian","engrtVmean","postClicks","shares","brand","program","accountType","post","perma_link","text","tag1","tag2","tag3","tag4","tag5","tag6","tag7","tag8","tag9","tag10","tag11","campaignID"
2024-09-18,"RMI Brand","Twitter",3,3300374,"nycw24",710,0.316,0.102,18,-0.379,-0.519,0.025,-0.468,-0.603,5,5,1,0,"RMI Brand","Post","https://twitter.com/RockyMtnInst/status/1836494677983281306","Methane and carbon dioxide are two of the biggest drivers of global warming. Seeking dual metrics and separate targets to reduce these powerful greenhouse gases can get us closer to critical climate targets faster. https://t.co/1Kp9ukQJyn https://t.co/5Tzibck5Sb","[1] 12. Reduce Methane Leakage In India, China, US​","[4] Internal Article/ Blog","[3] Figure/ Graph","[2] RMI Intelligence","nycw24",NA,NA,NA,NA,NA,NA,"nycw24"
2024-09-16,"RMI Brand","Twitter",3,3135076,"[1] 17. Energy Transition Narrative [transition-narrative]",1340,1.484,1.08,54,0.862,0.444,0.04,-0.149,-0.365,29,8,1,0,"RMI Brand","Post","https://twitter.com/RockyMtnInst/status/1835498860539470096","Two-thirds of global energy production is wasted, resulting in $4.5 trillion in economic losses annually. By improving energy efficiency, we can cut costs and significantly reduce greenhouse gas emissions.

Read our latest article on the opportunity of energy efficiency and why…","[3] Stock","[4] Internal Article/ Blog","[1] 17. Energy Transition Narrative [transition-narrative]","[2] RMI Strategy",NA,NA,NA,NA,NA,NA,NA,"transition-narrative"
2024-09-13,"RMI Brand","Twitter",3,3300374,"nycw24",1066,0.976,0.655,32,0.103,-0.144,0.03,-0.362,-0.524,25,1,1,0,"RMI Brand","Post","https://twitter.com/RockyMtnInst/status/1834394565458976828","RMI is bringing the energy to Climate Week NYC, and you’re invited to join us! ⚡🌍 
 
We’ll be speaking at and hosting events all week throughout the city! To prep your schedule, check out all of RMI's events. Space is limited to these events, so RSVP to secure your spot today!…","[3] Text Graphic","[4] RMI Landing Page","[4] Pre Event/ Webinar","nycw24",NA,NA,NA,NA,NA,NA,NA,"nycw24"
2024-09-13,"RMI Brand","Facebook",2,3300374,"nycw24",61,-0.87,-0.9,0,-1,-1,0,-1,-1,0,0,1,0,"RMI Brand","Post","https://www.facebook.com/344520634375161/posts/961878549306030","RMI is bringing the energy to Climate Week NYC, and you’re invited to join us! ⚡🌍  
 
We’ll be speaking at and hosting events all week throughout the city! To prep your schedule, check out all of RMI's events. Space is limited to these events, so RSVP to secure your spot today! 🔥  
  
And even if you’re not headed to #ClimateWeek you can follow our insights, dive into updates, and join the behind-the-scenes looks at how we’re advancing climate solutions, right here on social. 💬👥 
  
Stay tuned!   
Learn more about RMI’s impact at Climate Week: https://bit.ly/3MGAT39","[3] Text Graphic","[4] RMI Landing Page","[4] Pre Event/ Webinar","nycw24",NA,NA,NA,NA,NA,NA,NA,"nycw24"
2024-09-11,"RMI Brand","Facebook",2,3135076,"[1] 17. Energy Transition Narrative [transition-narrative]",60,-0.872,-0.901,1,-0.933,-0.963,0.017,-0.514,-0.541,1,0,1,0,"RMI Brand","Post","https://www.facebook.com/344520634375161/posts/961049219388963","🌍⚡️ New Energy for a New Era⚡️🌍 
We’re about to make a big leap forward as we shift from fossil fuels to clean energy like solar, wind, and electric tech — almost doubling global energy efficiency in the process! 

🛑 The Issue:
Most of our energy supply today comes from burning fuels like coal and gas. Thisis great to produce heat but inefficient when we need electricity — about two-thirds of the original energy is wasted.  

Our modern world increasingly runs on electricity, not heat. This mismatch between supply and demand wastes an enormous amount of energy. 

⚡ The Solution: Renewables generate electricity directly, skipping the waste and making the energy system much more efficient. 

💥 Big Changes Ahead: Switching to renewables will lead to a huge boost in energy productivity, finally giving us the efficient energy we need for a cleaner, smarter future! We saw that after World War 2 when more efficient oil and gas replaced coal and biomass. We will see it again in the coming decades.

Read the full report: https://bit.ly/3B1nuA0","[3] Stock","[4] Internal Article/ Blog","[1] 17. Energy Transition Narrative [transition-narrative]","[2] RMI Strategy",NA,NA,NA,NA,NA,NA,NA,"transition-narrative"
2024-09-11,"RMI Brand","Twitter",3,3135076,"[1] 17. Energy Transition Narrative [transition-narrative]",949,0.759,0.473,59,1.034,0.578,0.062,0.319,-0.016,41,5,1,0,"RMI Brand","Post","https://twitter.com/RockyMtnInst/status/1833961715110666504","We’re about to make a big leap forward as we shift from fossil fuels to clean energy like solar, wind, and electric tech — almost doubling global energy efficiency in the process. Learn how: https://t.co/RnDzQv4VHT","[3] Stock","[4] Internal Article/ Blog","[1] 17. Energy Transition Narrative [transition-narrative]","[2] RMI Strategy",NA,NA,NA,NA,NA,NA,NA,"transition-narrative"
2024-08-28,"RMI Brand","Twitter",3,3300374,"nycw24",900,0.668,0.397,44,0.517,0.176,0.049,0.043,-0.222,25,1,1,0,"RMI Brand","Post","https://twitter.com/RockyMtnInst/status/1828885328163115388","You’re invited! We will be at Scandinavia House on September 24 for a day of insightful conversations at #ClimateWeekNYC

Learn more and register: https://t.co/BYqPVLWPbd https://t.co/9gu7XYvnoD","[3] Text Graphic","[4] Pre Event/ Webinar","[2] RMI Brand","nycw24",NA,NA,NA,NA,NA,NA,NA,"nycw24"
2024-08-19,"RMI Brand","Facebook",2,3135066,"OCI+",675,0.439,0.11,29,0.933,0.07,0.043,0.229,0.162,12,2,1,0,"RMI Brand","Post","https://www.facebook.com/344520634375161/posts/944417951052090","The recently launched Tanager-1 satellite from Carbon Mapper and partners Planet and NASA Jet Propulsion Laboratory can pinpoint emissions at or within individual facilities, an exciting milestone for advanced methane emissions monitoring.

In addition to providing freely available data for platforms like RMI’s Oil Climate Index plus Gas (OCI+) to determine real-world oil and gas emissions, this and upcoming Carbon Mapper Coalition satellites contribute to a growing system of visibility tools that help spot and stop methane leakage before it causes significant climate damage.

Learn more about Carbon Mapper: https://bit.ly/4ct47wF

#Methane #Emissions #EmissionsData","[1] 12. Reduce Methane Leakage In India, China, US​","[3] Text Graphic","[3] RMIer(s)","[4] RMI Landing Page","[2] RMI Intelligence",NA,NA,NA,NA,NA,NA,"oci+"
2024-08-19,"RMI Brand","Twitter",3,3135066,"OCI+",1483,1.749,1.302,54,0.862,0.444,0.036,-0.234,-0.429,29,9,1,0,"RMI Brand","Post","https://twitter.com/RockyMtnInst/status/1825623042753445932","🛰️ The recently launched @Planet and @CarbonMapper coalition’s Tanager-1 satellite will help make #methane and CO2 #emissions visible and actionable.  

RMI’s OCI+ platform uses Carbon Mapper data to assess emissions from oil and gas assets: https://t.co/yHj3bfGYOO https://t.co/OW0mapv48c","[1] 12. Reduce Methane Leakage In India, China, US​","[3] Text Graphic","[3] RMIer(s)","[4] RMI Landing Page","[2] RMI Intelligence",NA,NA,NA,NA,NA,NA,"oci+"
2024-08-19,"RMI Brand","Facebook",2,3135076,"[1] 17. Energy Transition Narrative [transition-narrative]",984,1.098,0.618,54,2.6,0.993,0.055,0.571,0.486,10,8,1,0,"RMI Brand","Post","https://www.facebook.com/344520634375161/posts/944265657733986","Electrification offers a path to reduce emissions from transportation. As demand for electric vehicles grows, battery chemistry innovations, energy density improvements, and recycling help limit demand for battery materials.  

""One of the biggest things people hold against EVs might turn out to be one of its biggest benefits in the long run,"" said RMI’s Daan Walter. ​""Battery minerals have a tremendous benefit over oil, and that’s that you can reuse them.""

via Canary Media: https://bit.ly/4fOM86M 

#Electrification #Decarbonization #ElectricVehicles #EVs","[3] Text Graphic","[1] 17. Energy Transition Narrative [transition-narrative]","[2] RMI Strategy","[4] RMI In Media",NA,NA,NA,NA,NA,NA,NA,"transition-narrative"
2024-08-19,"RMI Brand","Twitter",3,3135076,"[1] 17. Energy Transition Narrative [transition-narrative]",727,0.348,0.129,10,-0.655,-0.733,0.014,-0.702,-0.778,4,1,1,0,"RMI Brand","Post","https://twitter.com/RockyMtnInst/status/1825573471444664448","Electrification offers a path to reduce emissions from transportation. As demand for EVs grows, battery chemistry innovations, energy density improvements, and recycling help limit demand for battery materials. 

📰 @CanaryMediaInc: https://t.co/k2N2NqjLNw https://t.co/Qzid1L76eM","[3] Text Graphic","[1] 17. Energy Transition Narrative [transition-narrative]","[4] RMI In Media","[2] RMI Strategy",NA,NA,NA,NA,NA,NA,NA,"transition-narrative"
2024-08-09,"RMI Brand","Twitter",3,3135076,"[1] 17. Energy Transition Narrative [transition-narrative]",797,0.477,0.237,16,-0.448,-0.572,0.02,-0.574,-0.683,9,2,1,0,"RMI Brand","Post","https://twitter.com/RockyMtnInst/status/1821973744945951132","Increasing investment in clean hydrogen requires coordination between financial institutions, project developers, and policymakers. 

RMI experts share more in @_LatitudeMedia: https://t.co/7sMPEiq52e https://t.co/mUhYKIjwux","[4] Internal Article/ Blog","[3] Text Graphic","[1] 17. Energy Transition Narrative [transition-narrative]","[2] RMI Strategy",NA,NA,NA,NA,NA,NA,NA,"transition-narrative"
2024-08-08,"RMI Brand","Instagram",4,3135076,"[1] 17. Energy Transition Narrative [transition-narrative]",1283,0.45,0.324,59,2.105,1.77,0.046,1.3,1.091,NA,9,1,0,"RMI Brand","Post","https://www.instagram.com/p/C-bIW50pL1R/","On your marks, get set, go! The global race to the top is underway to lead the energy technologies of the future.

The energy transition today is principally driven by three regions — China, Europe, and the United States — competing across three areas: cleantech supply chains, cleantech deployment, and electrification. 

China is currently in the lead, but the marathon has only just begun. Only 40 percent of electricity is clean, 20 percent of energy is electrified, and 20 percent of car sales are electric. Europe and the United States are pushing to compete, as evidenced by the passing of the Inflation Reduction Act and RepowerEU. As the energy transition continues, there will be many opportunities for another region to take the lead. 

Click the link in our bio to learn more.

#EnergyTransition #Cleantech #Climatetech #China #Europe #UnitedStates","[4] Internal Article/ Blog","[3] Text Graphic","[1] 17. Energy Transition Narrative [transition-narrative]","[3] Figure/ Graph","[2] RMI Strategy",NA,NA,NA,NA,NA,NA,"transition-narrative"
2024-08-08,"RMI Brand","Facebook",2,3135076,"[1] 17. Energy Transition Narrative [transition-narrative]",478,0.019,-0.214,34,1.267,0.255,0.071,1.029,0.919,24,4,1,0,"RMI Brand","Post","https://www.facebook.com/344520634375161/posts/936728498487702","On your marks, get set, go! The global race to the top is underway to lead the energy technologies of the future.

The energy transition today is principally driven by three regions — China, Europe, and the United States — competing across three areas: cleantech supply chains, cleantech deployment, and electrification. 

China is currently in the lead, but the marathon has only just begun. Only 40 percent of electricity is clean, 20 percent of energy is electrified, and 20 percent of car sales are electric. Europe and the United States are pushing to compete, as evidenced by the passing of the Inflation Reduction Act and RepowerEU. As the energy transition continues, there will be many opportunities for another region to take the lead: https://bit.ly/3LWqVKw  

#EnergyTransition #Cleantech #Climatetech #China #Europe #UnitedStates","[4] Internal Article/ Blog","[3] Text Graphic","[3] Figure/ Graph","[1] 17. Energy Transition Narrative [transition-narrative]","[2] RMI Strategy",NA,NA,NA,NA,NA,NA,"transition-narrative"
2024-08-08,"RMI Brand","Twitter",3,3135076,"[1] 17. Energy Transition Narrative [transition-narrative]",878,0.627,0.363,40,0.379,0.07,0.046,-0.021,-0.27,24,3,1,0,"RMI Brand","Post","https://twitter.com/RockyMtnInst/status/1821611357613007161","On your marks, get set, go! The global race is underway to lead the energy technologies of the future. https://t.co/QoMmsSXlqk 

China, Europe, and the US are competing across three areas: 

📦 Cleantech supply chains
🚗 Cleantech deployment
⚡ Electrification https://t.co/2cSc7qB1lC","[4] Internal Article/ Blog","[3] Text Graphic","[3] Figure/ Graph","[1] 17. Energy Transition Narrative [transition-narrative]","[2] RMI Strategy",NA,NA,NA,NA,NA,NA,"transition-narrative"
2024-07-16,"RMI Brand","Facebook",2,3135076,"[1] 17. Energy Transition Narrative [transition-narrative]",667,0.422,0.097,22,0.467,-0.188,0.033,-0.057,-0.108,4,2,1,0,"RMI Brand","Post","https://www.facebook.com/344520634375161/posts/921515193342366","#GoodClimateNews: Thanks to over 5 million solar installations, the US is better prepared to avoid summer blackouts. 👏

Solar energy is keeping our homes cool and our lights on during heatwaves, reducing electricity costs, and enhancing grid resilience.

An extra 25 GW of solar capacity has been added since last year, ensuring a more resilient grid, CNET reports: https://www.cnet.com/home/energy-and-utilities/record-solar-installations-are-good-news-for-avoiding-summer-power-outages/

🎨 By: Nicole Kelner","[3] Digital Illustration","[2] RMI Electricity","[4] External Landing Page","[1] 17. Energy Transition Narrative [transition-narrative]",NA,NA,NA,NA,NA,NA,NA,"transition-narrative"
2024-07-16,"RMI Brand","Twitter",3,3135076,"[1] 17. Energy Transition Narrative [transition-narrative]",2063,2.824,2.202,73,1.517,0.952,0.035,-0.255,-0.444,40,8,1,0,"RMI Brand","Post","https://twitter.com/RockyMtnInst/status/1813238702035939342","🌞#GoodClimateNews: Solar panels lower electricity costs, reduce carbon emissions, and enhance grid resilience.

Today, 7% of US homes have solar; by 2030, it should grow to 15%: https://t.co/nWZESFUVU1

🎨 By: @NicoleKelner https://t.co/P0J2ubVUBV","[3] Digital Illustration","[2] RMI Electricity","[4] External Landing Page","[1] 17. Energy Transition Narrative [transition-narrative]",NA,NA,NA,NA,NA,NA,NA,"transition-narrative"
2024-07-04,"RMI Brand","Facebook",2,3135076,"[1] 17. Energy Transition Narrative [transition-narrative]",279,-0.405,-0.541,14,-0.067,-0.483,0.05,0.429,0.351,3,1,1,0,"RMI Brand","Post","https://www.facebook.com/344520634375161/posts/913708900789662","🌍 #GoodClimateNews: California has achieved what many thought impossible.

Beginning in early March of this year, a combination of solar, wind, geothermal, and hydropower has consistently generated more than 100% of the state's electricity demand for part of nearly every day.

On some afternoons, solar panels alone have produced more power than the state consumes.

At night, large utility-scale batteries installed over the past few years become the grid’s largest power source, redistributing stored energy to consumers.

California, boasting the fifth-largest economy in the world, has demonstrated that a thriving modern economy can indeed run on clean energy.

However, California's achievement is not an isolated success. According to our most recent insights, the world might reach peak fossil-fuel use this year, driven by a surge in renewable energy. 👏

Learn more: ","[3] Stock","[1] 17. Energy Transition Narrative [transition-narrative]","[2] RMI Strategy","[4] RMI In Media",NA,NA,NA,NA,NA,NA,NA,"transition-narrative"
2024-07-04,"RMI Brand","Twitter",3,3135076,"[1] 17. Energy Transition Narrative [transition-narrative]",45019,82.446,68.884,1296,43.69,33.652,0.029,-0.383,-0.54,847,112,1,0,"RMI Brand","Post","https://twitter.com/RockyMtnInst/status/1808933546783908185","California has achieved what many thought impossible.

Since March, solar, wind, geothermal, and hydropower have generated 100%+ of the state's electricity demand nearly every day. A thriving economy can indeed run on clean energy! 👏 https://t.co/QpxxX4wUBN","[3] Stock","[1] 17. Energy Transition Narrative [transition-narrative]","[4] RMI In Media","[2] RMI Strategy",NA,NA,NA,NA,NA,NA,NA,"transition-narrative"
2024-06-25,"RMI Brand","Facebook",2,3135076,"[1] 17. Energy Transition Narrative [transition-narrative]",978,1.085,0.609,56,2.733,1.066,0.057,0.629,0.541,18,10,1,0,"RMI Brand","Post","https://www.facebook.com/344520634375161/posts/907231931437359","The energy system is being transformed by the exponential forces advancing renewables, electrification, and efficiency.
 
In the past decade, cleantech costs have fallen by up to 80 percent, while investment is up nearly tenfold, and solar generation has risen twelvefold. Electricity has become the largest source of useful energy, and the deep force of efficiency has reduced energy demand by a fifth.

Half of the worldwide growth in cleantech is from China, but exponential growth is also happening across the OECD (rich countries) and in the Global South as Asia electrifies. By 2030, we will be installing 1,000 GW of solar a year and selling 6,000 GWh of batteries a year, making possible the COP goal of tripling renewable capacity.

This is the pivotal decade. When falling cleantech costs become financially irresistible, renewable capacity expands, and fossil fuel demand reaches the end of its plateau, the Paris Agreement could be within reach. The direction of change is inevitable, but the speed is up to us. Now is the time to act. https://bit.ly/4eBtsH0

#Cleantech #Climatetech #CleanEnergy #RenewableEnergy #EnergyEfficiency","[1] 14. Drive Market For Climate Products And Services","[4] RMI Report","[3] Figure/ Graph","[1] 17. Energy Transition Narrative [transition-narrative]","[2] RMI Strategy",NA,NA,NA,NA,NA,NA,"transition-narrative"
2024-04-24,"RMI Brand","Facebook",2,2312794,"OCI+",122,-0.74,-0.799,11,-0.267,-0.594,0.09,1.571,1.432,3,2,1,0,"RMI Brand","Post","https://www.facebook.com/344520634375161/posts/865891738904712","Oil and gas producers burn off unwanted gas in a process known as ""flaring."" The carbon dioxide and methane emitted by flares accelerate climate change — and pose significant health risks to local communities.

In the United States, approximately 18 million people live within two kilometers of an oil and gas well. Flares and their associated emissions are known to have negative health impacts and to form smog, which is linked to cardiovascular, nervous system, and reproductive health issues.

RMI’s Oil Climate Index plus Gas (OCI+) web tool analyzes the wide-ranging climate impacts of oil and gas production. Now, the Flaring EJ Risk Map, a new environmental justice risk feature, has been added to consider the underlying demographics in the vicinity of flares so that decision-makers can better protect public health and the environment, especially for vulnerable populations. https://bit.ly/4b5TTlK

#CarbonEmissions #pollution #EnvironmentalJustice #methane","[3] Stock","[4] Internal Article/ Blog","[1] RMI Intelligence",NA,NA,NA,NA,NA,NA,NA,NA,"oci+"
2023-12-15,"RMI Brand","Twitter",3,2698565,"COP28",760,0.409,0.18,14,-0.517,-0.626,0.018,-0.617,-0.714,8,1,1,0,"RMI Brand","Post","https://twitter.com/RockyMtnInst/status/1735699742665908391","Experts are weighing in on the outcomes of the #COP28 climate talks. They include RMI's @Jon_Creyts, who hails it as a milestone second only to the 2015 Paris talks, highlighting the vast private sector and community engagement.

More in @AP: https://t.co/1z0HTRkc9U 💥","COP28","[3] Real People","[4] RMI In Media","[1] RMI Strategy",NA,NA,NA,NA,NA,NA,NA,"cop28"
2023-12-15,"RMI Brand","Facebook",2,2698565,"COP28",216,-0.539,-0.645,9,-0.4,-0.668,0.042,0.2,0.135,3,1,1,0,"RMI Brand","Post","https://www.facebook.com/344520634375161/posts/780018494158704","As the curtain falls on #COP28, it's clear that this was a defining moment, as RMI's CEO, Jon Creyts noted.
 
Heralded as a major step ahead, the outcomes of this year's summit have established a new benchmark in our global fight against climate change.
 
Dive into the comprehensive analysis by AP: https://bit.ly/3v0ox09","COP28","[3] Real People","[4] RMI In Media","[1] RMI Strategy",NA,NA,NA,NA,NA,NA,NA,"cop28"
2023-12-14,"Jon Creyts","Twitter",3,2698565,"COP28",447,2.412,0.649,12,-0.676,-0.59,0.027,-0.745,-0.825,9,1,0,1,"RMI Program","Post","https://twitter.com/Jon_Creyts/status/1735381626396213434","As I told @AP, #COP28 engaged the private sector and local communities at a scale that is unprecedented.

https://t.co/4RSMFndCu2","COP28",NA,NA,NA,NA,NA,NA,NA,NA,NA,NA,"cop28"
2023-12-13,"RMI Brand","Facebook",2,2698565,"COP28",442,-0.058,-0.273,17,0.133,-0.373,0.038,0.086,0.027,10,2,1,0,"RMI Brand","Post","https://www.facebook.com/344520634375161/posts/778683697625517","🚨BREAKING: Our CEO Jon Creyts reflects on #COP28's decisive move towards renewable energy.
 
The commitment to triple renewable sources and double energy efficiency marks a new era of environmental progress.👇","[3] Text Graphic","COP28","[1] RMI Brand","[4] Pre Event/ Webinar",NA,NA,NA,NA,NA,NA,NA,"cop28"
2023-12-13,"RMI Brand","Instagram",4,2698565,"COP28",984,0.112,0.016,74,2.895,2.474,0.075,2.75,2.409,NA,NA,1,0,"RMI Brand","Post","https://www.instagram.com/p/C0zKT8gOT7S/","🚨BREAKING: #COP28 outcome, our CEO's take: Fossil fuels will be in the rearview mirror, renewables are our future.
 
With commitments to expand solar, battery tech, and EVs, we can transform our planet's health. 👏","[3] Text Graphic","COP28","[1] RMI Brand","[4] Pre Event/ Webinar",NA,NA,NA,NA,NA,NA,NA,"cop28"
2023-12-13,"RMI Brand","Twitter",3,2698565,"COP28",864,0.601,0.341,39,0.345,0.043,0.045,-0.043,-0.286,22,5,1,0,"RMI Brand","Post","https://twitter.com/RockyMtnInst/status/1734968330048434433","🚨BREAKING: Our CEO @Jon_Creyts reflects on #COP28's decisive move towards renewable energy.

The commitment to triple renewable sources and double energy efficiency marks a new era of environmental progress. 🎉 https://t.co/vMaq8BktII","[3] Text Graphic","COP28","[1] RMI Brand","[4] Pre Event/ Webinar",NA,NA,NA,NA,NA,NA,NA,"cop28"
2023-12-13,"RMI Brand","Twitter",3,2698565,"COP28",1207,1.237,0.874,54,0.862,0.444,0.045,-0.043,-0.286,36,4,1,0,"RMI Brand","Post","https://twitter.com/RockyMtnInst/status/1734767063686627443","We asked our CEO, @Jon_Creyts, ""What is giving you hope at this COP28?"". Here's what he had to say. 👇

#COP28 #methane #renewables #CleanEnergy @COP28_UAE https://t.co/72EnfOUgJ2","[4] Misc. Non-CTA","COP28","[1] RMI Brand","[3] <2.2 mins Video",NA,NA,NA,NA,NA,NA,NA,"cop28"
2023-12-13,"RMI Brand","Facebook",2,2698565,"COP28",367,-0.217,-0.396,8,-0.467,-0.705,0.022,-0.371,-0.405,2,2,1,0,"RMI Brand","Post","https://www.facebook.com/344520634375161/videos/1424785884776088","We asked our CEO, Jon Creyts, ""What is giving you hope at this COP28?"" and three things stood out.

1️⃣ Progress on mitigating methane.

2️⃣ Preparing for global progress in heavy industry (green steel, green cement, and aluminum).

3️⃣ 117 countries targeting to triple renewables by 2030!

While we await the final outcome from COP28, we know the energy transition is happening faster in some sectors and behind in others. We applaud the progress made by RMI and partners in the past few weeks and push for even more ambition and action in 2024.

#COP28 #methane #renewables #CleanEnergy","COP28","[1] RMI Brand","[4] Pre Event/ Webinar","[3] <2.2 mins Video",NA,NA,NA,NA,NA,NA,NA,"cop28"
2023-12-12,"RMI Brand","Twitter",3,2698565,"COP28",1179,1.185,0.83,12,-0.586,-0.679,0.01,-0.787,-0.841,4,2,1,0,"RMI Brand","Post","https://twitter.com/RockyMtnInst/status/1734637898811494587","RMI's @dinacappiello provides a recap on #COP28UAE after her return from the conference and looks at what we should be tracking as the conference closes.","COP28",NA,NA,NA,NA,NA,NA,NA,NA,NA,NA,"cop28"
2023-12-12,"RMI Brand","Twitter",3,2698565,"COP28",1983,2.676,2.078,62,1.138,0.658,0.031,-0.34,-0.508,47,2,1,0,"RMI Brand","Post","https://twitter.com/RockyMtnInst/status/1734402937718268186","#CleanEnergy isn’t just growing, it’s exploding in ways that may surprise you. @TEDCountdown &amp; @manoushz present a pivotal film feat. RMI’s @KingsmillBond, @HabibaDaggash, &amp; @duda_zoghbi. Watch it NOW: https://t.co/xO60Jm3ZWr https://t.co/aMHz3LTe9k","COP28","[3] Real People","[4] Pre Event/ Webinar","[1] RMI Strategy",NA,NA,NA,NA,NA,NA,NA,"cop28"
2023-12-12,"RMI Brand","Facebook",2,2698565,"COP28",234,-0.501,-0.615,17,0.133,-0.373,0.073,1.086,0.973,2,3,1,0,"RMI Brand","Post","https://www.facebook.com/344520634375161/posts/777697877724099","Imagine a future where every light, every car, every home is powered by #CleanEnergy.

That future is now.

TED Countdown's film (feat. expert insights from RMI’s Kingsmill Bond, Eduarda Zoghbi, and Habiba Ahut Daggash) showcases the extraordinary ways clean energy is integrating into our lives and leading global change NOW. 👏

Watch the film here: https://www.ted.com/talks/ted_countdown_ted_explores_a_new_climate_vision?ref=upstract.com

#GoodClimateNews #AppliedHope #AheadOfTheCurve","COP28","[3] Real People","[4] Pre Event/ Webinar","[1] RMI Strategy",NA,NA,NA,NA,NA,NA,NA,"cop28"
